tweet_id,text,rating_numerator,rating_denominator,name,retweets,favorites,breed,stage
728387165835677696,"This is Enchilada (yes, that's her real name). She's a Low-Cruisin Plopflopple. Very rare. Only a few left. 12/10 https://t.co/SiaiTWgsfP",12,10,Enchilada,891,3489,collie,
728046963732717569,This is Raymond. He controls fountains with his tongue. 11/10 pretty damn magical https://t.co/9aMxSbOaAZ,11,10,Raymond,1112,4028,Newfoundland,
728015554473250816,This is Rueben. He has reached ultimate pupper zen state. 11/10 tranquil af https://t.co/Z167HgtnBi,11,10,Rueben,1018,3879,cocker_spaniel,pupper
727685679342333952,This is Cilantro. She's a Fellation Gadzooks. Eyes are super magical af. 12/10 could get lost in https://t.co/yJ26LNuyj5,12,10,Cilantro,588,2794,Border_collie,
727175381690781696,This is Karll. He just wants to go kayaking. 10/10 please someone take Karll kayaking already https://t.co/vXLkvyNQHp,10,10,Karll,1278,3664,flat-coated_retriever,
726887082820554753,This is Blitz. He's a new dad struggling to cope mentally with the pressures of being a father. Sick shades 10/10 https://t.co/2AVcJ2BZsy,10,10,Blitz,1399,3609,soft-coated_wheaten_terrier,
726828223124897792,This is Bloop. He's a Phoenician Winnebago. Tongue is just wow. That box is all he has (tragic). 12/10 would caress https://t.co/DWNrPPXgHA,12,10,Bloop,938,3364,miniature_pinscher,
725842289046749185,This is Colby. He's currently regretting all those times he shook your hand for an extra treat. 12/10 https://t.co/vtVHtKFtBH,12,10,Colby,2477,6659,toy_poodle,
725786712245440512,Say hello to Lillie. She's a Rutabagan Floofem. Poor pupper ate and then passed out. 11/10 relatable af https://t.co/uIdGqug9rw,11,10,Lillie,1273,3932,chow,pupper
725729321944506368,This is Lola. She's a Butternut Splishnsplash. They are known to be ferocious af. 12/10 would absolutely still pet https://t.co/adQt5a6TZU,12,10,Lola,1648,4897,boxer,
724983749226668032,This is Fred-Rick. He dabbles in parkour. The elevation gives him power. 12/10 hopefully visiting a mailbox near you https://t.co/qFqLtudIiD,12,10,Fred,1199,3511,golden_retriever,
724405726123311104,This is Ashleigh. She's having Coachella withdrawals. Didn't even go tho. 10/10 stay strong pupper https://t.co/nRUaKWnJfH,10,10,Ashleigh,1549,4970,golden_retriever,pupper
724049859469295616,This is Kreggory. He just took a look at his student debt. 10/10 can't even comprehend it https://t.co/XTsZTgilnT,10,10,Kreggory,1656,4063,Border_collie,
724046343203856385,"This is Sarge. Not even he knows what his tongue is doing, but it's pretty damn spectacular. 10/10 https://t.co/pIQEdbBxdL",10,10,Sarge,521,2505,boxer,
723912936180330496,This is Sugar. She's a Bolivian Superfloof. Spherical af. 12/10 would never let go of https://t.co/AhMfUu6Onm,12,10,Sugar,1151,3671,Samoyed,
723673163800948736,This is Ivar. She is a badass Viking warrior. Will sack your village. 10/10 savage af https://t.co/Dz6MiVssVU,10,10,Ivar,831,2849,golden_retriever,
722613351520608256,Meet Schnitzel. He's a Tropicana Floofboop. Getting too big for his favorite basket. 12/10 just so damn fluffy https://t.co/qjd0UJKYUY,12,10,Schnitzel,1527,4677,Labrador_retriever,
721503162398597120,This is Panda. He's happy af. 11/10 https://t.co/IOAk9i4UvE,11,10,Panda,1683,4335,Pomeranian,
721001180231503872,This is Oliver. Bath time is upon him. His fear of the wetness postpones his ultimate pupper destiny. 11/10 https://t.co/AFzzKqR4tT,11,10,Oliver,569,2386,Samoyed,pupper
720785406564900865,This is Archie. He hears everything you say. Doesn't matter where you are. 12/10 https://t.co/0l4I8famYp,12,10,Archie,716,2906,Chihuahua,
720775346191278080,This is Berkeley. He's in a predicament. 10/10 someone help him https://t.co/XSEXdQupej,10,10,Berkeley,600,2308,Newfoundland,
720389942216527872,This is RalphÃ©. He patrols the lake. Looking for babes. 11/10 https://t.co/Pb6iMmo0wk,11,10,RalphÃ©,2313,5983,Pembroke,
720059472081784833,This is Charleson. He lost his plunger. Looked everywhere. Can't find it. So sad. 9/10 would comfort https://t.co/pRHX8yn9Yu,9,10,Charleson,1042,3625,Mexican_hairless,
720043174954147842,This is Neptune. He's a Snowy Swiss Mountain Floofapolis. Cheeky wink. Tongue nifty af. 11/10 would pet so firmly https://t.co/SoZq2Xoopv,11,10,Neptune,1868,4662,Samoyed,
719551379208073216,This is Harnold. He accidentally opened the front facing camera. 10/10 get it together Harnold https://t.co/S6JHaSMtln,10,10,Harnold,1762,4746,malamute,
719339463458033665,Say hello to Lucy and Sophie. They think they're the same size. Both 10/10 would snug at same time https://t.co/HW50zkcf2R,10,10,Lucy,1145,4197,golden_retriever,
719332531645071360,This is Pippa. She managed to start the car but is waiting for you to buckle up before driving. Responsible af 11/10 https://t.co/htrlmC7saz,11,10,Pippa,883,3241,Dandie_Dinmont,
718971898235854848,This is Sadie. She is prepared for battle. 10/10 https://t.co/JRckDkZVRT,10,10,Sadie,1005,3274,golden_retriever,
718939241951195136,This is Otis. Everybody look at Otis. 12/10 would probably faint while petting https://t.co/I9qoe1uEih,12,10,Otis,1622,4918,Pembroke,
718613305783398402,This is Carper. He's a Tortellini Angiosperm. In desperate need of a petting. 11/10 would hug softly https://t.co/lK9YDkRzPj,11,10,Carper,442,2306,Labrador_retriever,
718246886998687744,This is Alexanderson. He's got a weird ass birth mark. Dreadful at fetch. Won't eat kibble. 3/10 wtf @Target https://t.co/FmxOpf2Sgl,3,10,Alexanderson,460,1799,Chihuahua,
718234618122661888,This is Suki. She was born with a blurry tail (unfortunate). Next level tongue tho. 11/10 nifty hardwood https://t.co/05S8oYztgb,11,10,Suki,929,3638,malamute,
717841801130979328,This is Barclay. His father was a banana. 11/10 appeeling af https://t.co/ucOEfr2rjV,11,10,Barclay,556,2315,Brittany_spaniel,
717421804990701568,This is Ebby. She's a Zimbabwean Feta. Embarrassed by ridiculously squishy face. 9/10 would squeeze softly https://t.co/LBJqxMGaHi,9,10,Ebby,774,2948,miniature_pinscher,
717047459982213120,This is FlÃ¡vio (pronounced Baxter). He's a Benesnoop Cumberdog. Super rare. Symmetrical. 12/10 would pet so well https://t.co/fGgleFiBPq,12,10,FlÃ¡vio,1780,5908,golden_retriever,
717009362452090881,This is Smokey. He's having some sort of existential crisis. 10/10 hang in there pupper https://t.co/JmgF4dMpw0,10,10,Smokey,889,3041,Siberian_husky,pupper
716802964044845056,This is Link. He struggles with couches. 10/10 would assist https://t.co/SbX4e6Yg3o,10,10,Link,1081,4047,malinois,
716791146589110272,Meet Jennifur. She's supposed to be navigating. Not even buckled up. Insubordinate &amp; churlish. 11/10 would still pet https://t.co/h0trcJohYO,11,10,Jennifur,1476,7791,Pomeranian,
716439118184652801,This is Bluebert. He just saw that both #FinalFur match ups are split 50/50. Amazed af. 11/10 https://t.co/Kky1DPG4iq,50,50,Bluebert,196,2249,Siberian_husky,
716285507865542656,This is Stephanus. She stays woke. 12/10 https://t.co/WIWabMngQZ,12,10,Stephanus,981,2612,Yorkshire_terrier,
715928423106027520,This is Bubbles. He's a Yorkshire Piccolope. 11/10 would snug aggressively https://t.co/3BhMojONxq,11,10,Bubbles,814,2994,pug,
715696743237730304,Meet Toby. He's a Lithuanian High-Steppin Stickeroo. One of the more accomplished Stickeroos around. 10/10 so nifty https://t.co/cYPHuJYTjC,10,10,Toby,1198,3687,Staffordshire_bullterrier,
715680795826982913,This is Zeus. He's downright fabulous. 12/10 https://t.co/sSugyyRuTp,12,10,Zeus,1481,4045,golden_retriever,
715342466308784130,This is Oscar. He's a world renowned snowball inspector. It's a ruff job but someone has to do it. 10/10 great guy https://t.co/vSufMAKm3C,10,10,Oscar,640,2862,West_Highland_white_terrier,
715220193576927233,This is Nico. His selfie game is strong af. Excellent use of a sneaky tongue slip. 10/10 star material https://t.co/1OBdJkMOFx,10,10,Nico,604,2272,Chihuahua,
715200624753819648,This is Michelangelope. He's half coffee cup. Rare af. 12/10 would hug until someone stopped me https://t.co/tvVDY0G911,12,10,Michelangelope,1737,4861,Chihuahua,
714982300363173890,This is Calbert. He forgot to clear his Google search history. 9/10 rookie mistake Calbert https://t.co/jRm5J3YCmj,9,10,Calbert,957,3510,Brittany_spaniel,
714957620017307648,This is Curtis. He's an Albino Haberdasher. Terrified of dandelions. They really spook him up. 10/10 it'll be ok pup https://t.co/s8YcfZrWhK,10,10,Curtis,1305,3900,Great_Pyrenees,
714258258790387713,"Meet Travis and Flurp. Travis is pretty chill but Flurp can't lie down properly. 10/10 &amp; 8/10
get it together Flurp https://t.co/Akzl5ynMmE",10,10,Travis,682,2871,collie,
714251586676113411,This is Thumas. He hates potted plants. 8/10 wtf Thumas https://t.co/rDVueNIcEi,8,10,Thumas,778,3094,soft-coated_wheaten_terrier,
713919462244790272,This is Kanu. He's a Freckled Ticonderoga. Simply flawless. 12/10 would perform an elaborate heist to capture https://t.co/7vyAzIURrE,12,10,Kanu,739,3102,Siberian_husky,
713761197720473600,This is Piper. She would really like that tennis ball core. Super sneaky tongue slip. 12/10 precious af https://t.co/QP6GHi5az9,12,10,Piper,1264,4568,Brittany_spaniel,
713177543487135744,This is Lance. Lance doesn't give a shit. 10/10 we should all be more like Lance https://t.co/SqnG9Ap28J,10,10,Lance,2660,6797,whippet,
712809025985978368,This is Stubert. He just arrived. 10/10 https://t.co/HVGs5aAKAn,10,10,Stubert,6229,17931,Labrador_retriever,
712668654853337088,Say hello to Sunny and Roxy. They pull things out of water together. 10/10 for both https://t.co/88aedAmxcl,10,10,Sunny,1124,3911,Labrador_retriever,
712085617388212225,"Say hello to Olive and Ruby. They are best buddies. Both 11/10 
1 like = 1 buddy https://t.co/yagmFdKlyL",11,10,Olive,454,3084,Shih-Tzu,
711743778164514816,Meet Roosevelt. He's calculating the best case scenario if he drops out instead of doing math hw. 11/10 relatable af https://t.co/QcSIRDpfVg,11,10,Roosevelt,925,2678,Lakeland_terrier,
711008018775851008,This is Chuckles. He had a balloon but he accidentally let go of it and it floated away. 11/10 hang in there pupper https://t.co/68iNM7B5gW,11,10,Chuckles,572,2817,French_bulldog,pupper
710997087345876993,Meet Milo and Amos. They are the best of pals. Both 12/10 would pet at the same time https://t.co/Mv37BHEyyD,12,10,Milo,1288,4307,malamute,
710833117892898816,Say hello to Sora. She's an Egyptian Pumpernickel. Mesmerizing af. 12/10 would bring home to mom https://t.co/PmTR4kxZkq,12,10,Sora,494,2527,Pembroke,
710588934686908417,This is Beemo. He's a Chubberflop mix. 12/10 would cross the world for https://t.co/kzMVMU8HBV,12,10,Beemo,1737,4277,Pembroke,
710283270106132480,This is Gunner. He's a Figamus Newton. King of the peek-a-boo. Cool jeans. 11/10 https://t.co/ONuBILIYXZ,11,10,Gunner,490,2041,Shih-Tzu,
710272297844797440,We ðŸ‘ðŸ» only ðŸ‘ðŸ» rate ðŸ‘ðŸ» dogs. Pls stop sending in non-canines like this Dutch Panda Worm. This is infuriating. 11/10 https://t.co/odfLzBonG2,11,10,infuriating,1171,4245,Old_English_sheepdog,
710140971284037632,This is Tater. His underbite is fierce af. Doesn't give a damn about your engagement photo. 8/10 https://t.co/nLuPY3pY12,8,10,Tater,826,2578,Pekinese,
709918798883774466,Meet Watson. He's a Suzuki Tickleboop. Leader of a notorious biker gang. Only one ear functional. 12/10 snuggable af https://t.co/R1gLc5vDqG,12,10,Watson,1012,3292,Pembroke,
709566166965075968,This is Olaf. He's gotta be rare. Seems sturdy. Tail is floofy af. 12/10 would do whatever it takes to pet https://t.co/E9jaU59bh9,12,10,Olaf,1112,3339,chow,
709556954897764353,This is Cecil. She's a Gigglefloof Poofer. Outdoorsy af. One with nature. 12/10 would strategically capture https://t.co/ijJB0DuOIC,12,10,Cecil,998,3090,golden_retriever,
709519240576036864,This is Vince. He's a Gregorian Flapjeck. White spot on legs almost looks like another dog (whoa). 9/10 rad as hell https://t.co/aczGAV2dK4,9,10,Vince,223,1416,cocker_spaniel,
709449600415961088,Meet Karma. She's just a head. Lost body during the Second Punic War (unfortunate). Loves to travel 10/10 petable af https://t.co/c6af6nYEPo,10,10,Karma,533,2077,Maltese_dog,
709409458133323776,This is Billy. He sensed a squirrel. 8/10 damn it Billy https://t.co/Yu0K98VZ9A,8,10,Billy,640,2494,Shetland_sheepdog,
709225125749587968,This is Walker. He's a Butternut Khalifa. Appears fuzzy af. 11/10 would hug for a ridiculous amount of time https://t.co/k6fEWHSALn,11,10,Walker,531,2263,Labrador_retriever,
709207347839836162,This is Penny. She's trying on her prom dress. Stunning af 11/10 https://t.co/qcZDZGCapg,11,10,Penny,5332,11703,Chihuahua,
709158332880297985,Meet Rodney. He's a Ukranian Boomchicka. Outside but would like to be inside. Only has one ear (unfortunate) 10/10 https://t.co/FjAj3ggXrR,10,10,Rodney,377,1917,Siberian_husky,
708834316713893888,Meet Malikai. He was rolling around having fun when he remembered the inevitable heat death of the universe. 10/10 https://t.co/Vd2FqHIIGn,10,10,Malikai,466,1587,Eskimo_dog,
708810915978854401,This is Mister. He's a wonderful father to his two pups. Heartwarming af. 10/10 for all https://t.co/2KcuJXL2r4,10,10,Mister,6416,15542,golden_retriever,
708738143638450176,This is Coco. She gets to stay on the Bachelor for another week. Super pumped 11/10 https://t.co/wsCB6LFNxD,11,10,Coco,763,2595,Pomeranian,
708479650088034305,Meet Bear. He's a Beneboop Cumberclap. Extremely unamused. 13/10 I'm in love with this picture https://t.co/uC8kUqAz0W,13,10,Bear,638,2396,Shih-Tzu,
708469915515297792,This is Bobble. He's a Croatian Galifianakis. Hears everything within 400 miles. 11/10 would snug diligently https://t.co/VwDc6PTDzk,11,10,Bobble,757,2919,Chihuahua,
708356463048204288,This is Oliver. That is his castle. He protects it with his life. He's also squishy af. 10/10 would squish softly https://t.co/oSuEGw0BhX,10,10,Oliver,1230,3371,pug,
708149363256774660,This is Jebberson. He's the reigning hide and seek world champion. 10/10 hasn't lost his touch https://t.co/VEFkvWCoHF,10,10,Jebberson,1442,4067,Cardigan,
708119489313951744,This is Cooper. He basks in the glory of rebellion. 9/10 probably a preteen https://t.co/kDamUfeIpm,9,10,Cooper,915,2534,Norwich_terrier,
708109389455101952,This is Remington. He was caught off guard by the magical floating cheese. Spooked af. 10/10 deep breaths pup https://t.co/mhPSADiJmZ,10,10,Remington,519,1841,Staffordshire_bullterrier,
707969809498152960,Meet Rufus. He's a Honeysuckle Firefox. Curly af. Badass tie. About to go on his first date ever 11/10 good luck pup https://t.co/dGoTWNfIsm,11,10,Rufus,891,2540,toy_poodle,
707776935007539200,This is Sadie. She's a Bohemian Rhapsody. Remarkably portable. Could sneak on roller coasters with (probably). 11/10 https://t.co/DB8fyeDs8B,11,10,Sadie,891,3087,miniature_pinscher,
707610948723478529,This is Harper. She scraped her elbow attempting a backflip off a tree. Valiant effort tho. 12/10 https://t.co/oHKJHghrp5,12,10,Harper,5884,15994,golden_retriever,
707387676719185920,Meet Clarkus. He's a Skinny Eastern Worcestershire. Can tie own shoes (impressive af) 10/10 would put on track team https://t.co/XP5o7zGn0E,10,10,Clarkus,1184,3297,Chihuahua,
707315916783140866,This is Finnegus. He's trapped in a snow globe. Poor pupper. 10/10 would make sure no one shook it https://t.co/BjpOa52jQ4,10,10,Finnegus,593,2334,Bernese_mountain_dog,pupper
707297311098011648,This is Cassie. She can go from sweet to scary af in a matter of seconds. 10/10 points deducted for cats on pajamas https://t.co/B6dmZmJBdK,10,10,Cassie,727,2626,Blenheim_spaniel,
707059547140169728,Say hello to Cupcake. She's an Icelandic Dippen Dot. Confused by the oddly geometric lawn pattern. 11/10 https://t.co/D7rorf4YKL,11,10,Cupcake,631,2451,Samoyed,
707038192327901184,This is Kathmandu. He sees every move you make. Probably knows Jiu-Jitsu. 10/10 mysterious af https://t.co/z0cs7E4Xjj,10,10,Kathmandu,731,2054,pug,
707021089608753152,This is Tucker. He's a Dasani Episcopalian. Good lord what a tongue. 12/10 would never let go of https://t.co/gHtW5cgyy7,12,10,Tucker,1255,3839,cocker_spaniel,
707014260413456384,This is Ellie. She requests to be carried around in a lacrosse stick at all times. 11/10 impossible to say no https://t.co/15yCmd43zU,11,10,Ellie,554,2173,Chihuahua,
706681918348251136,Say hello to Katie. She's a Mitsubishi Hufflepuff. Curly af. 12/10 I'd do terrible things to acquire such a pup https://t.co/CFPIcGcwJv,12,10,Katie,909,3105,toy_poodle,
706538006853918722,"This is Oliver (pronounced ""Ricardo""). He's a ship captain. Controls these treacherous waters. 11/10 would sail with https://t.co/bxjO45rXKd",11,10,Oliver,1336,3273,chow,
706346369204748288,This is Koda. She's a Beneboom Cumberwiggle. 12/10 petable as hell https://t.co/VZV6oMJmU6,12,10,Koda,863,3256,Tibetan_mastiff,
706265994973601792,"This is Kara. She's been trying to solve that thing for 3 days. ""I don't have thumbs,"" she said. 11/10 solid effort https://t.co/lA6a8GefrV",11,10,Kara,866,2580,papillon,
706166467411222528,This is Dexter. He's a shy pup. Doesn't bark much. Dreadful fetcher. Has rare sun allergy. 7/10 still petable https://t.co/sA7P3JSqiv,7,10,Dexter,1495,4835,Samoyed,
705975130514706432,This is Adele. Her tongue flies out of her mouth at random. It's a debilitating illness. 10/10 stay strong pupper https://t.co/cfn81n3FLO,10,10,Adele,676,2928,Staffordshire_bullterrier,pupper
705970349788291072,This is Lucy. She's a Venetian Kerploof. Supposed to be navigating. Quite irresponsible. Fancy ass collar tho 12/10 https://t.co/8tjnz1L8DI,12,10,Lucy,830,3005,golden_retriever,
705898680587526145,Meet Max. He's a Fallopian Cephalopuff. Eyes are magical af. Lil dandruff problem. No big deal 10/10 would still pet https://t.co/c67nUjwmFs,10,10,Max,512,2245,collie,
705475953783398401,Say hello to Zara. She found a sandal and couldn't be happier. 12/10 great work https://t.co/zQUuVu812n,12,10,Zara,854,2810,golden_retriever,
705442520700944385,This is Cooper. He only wakes up to switch gears. 12/10 helpful af https://t.co/EEIkAGVY64,12,10,Cooper,1496,4147,Great_Pyrenees,
705428427625635840,This is Ambrose. He's an Alfalfa Ballyhoo. Draws pistol fast af. Pretty much runs the frontier. 11/10 lethal pupper https://t.co/ih6epBOxIA,11,10,Ambrose,1560,3592,Chihuahua,pupper
705239209544720384,This is Jimothy. He lost his body during the the Third Crusade (tragic). 11/10 heroic af tho https://t.co/wnsblfu7XE,11,10,Jimothy,695,2831,Chihuahua,
705102439679201280,This is Terrenth. He just stubbed his toe. 10/10 deep breaths Terrenth https://t.co/Pg18CDFC7Z,10,10,Terrenth,485,2019,collie,
705066031337840642,This is Reese. He's a Chilean Sohcahtoa. Loves to swing. Never sure what to do with his feet. 12/10 huggable af https://t.co/VA6jnNUyuW,12,10,Reese,565,2062,Airedale,
704480331685040129,Meet Lucia. She's a Cumulonimbus Floofmallow. Only has two legs tho (unfortunate). 11/10 would definitely still pet https://t.co/qv6qlEUCEe,11,10,Lucia,1004,3208,Samoyed,
704364645503647744,Say hello to Bisquick. He's a Beneplop Cumbersnug. Even smiles when wet. 12/10 I'd steal Bisquick https://t.co/5zX5XD3i6K,12,10,Bisquick,3301,7510,Pembroke,
703611486317502464,Meet Scooter. He's experiencing the pupper equivalent of dropping ur phone in a toilet 10/10 put it in some rice pup https://t.co/JSmX1FIEaW,10,10,Scooter,1419,3632,Pembroke,pupper
703382836347330562,This is Charlie. He's a West Side Niddlewog. Mucho fluffy. 12/10 would pet so damn well https://t.co/B9dOrmnPVt,12,10,Charlie,1058,3297,golden_retriever,
703356393781329922,This is Socks. That water pup w the super legs just splashed him. Socks did not appreciate that. 9/10 and 2/10 https://t.co/8rc5I22bBf,9,10,Socks,358,1813,Border_collie,
702684942141153280,This is Lucy. She's sick of these bullshit generalizations 11/10 https://t.co/d2b5C2R0aO,11,10,Lucy,988,3052,golden_retriever,
702671118226825216,Meet Rambo &amp; Kiwi. Rambo's the pup with the sharp toes &amp; rad mohawk. One stays woke while one sleeps. 10/10 for both https://t.co/MpH1Fe9LhZ,10,10,Rambo,523,2062,bloodhound,
702598099714314240,"This is Sansa. She's gotten too big for her chair. Not so smol anymore. 11/10 once a pupper, always a pupper https://t.co/IpAoztle2s",11,10,Sansa,3198,11543,kelpie,pupper
701981390485725185,This is Fiji. She's a Powdered Stegafloof. Very rare. 12/10 https://t.co/fZRob6eotY,12,10,Fiji,917,3242,Pomeranian,
701952816642965504,Meet Rilo. He's a Northern Curly Ticonderoga. Currently balancing on one paw even in strong wind. Acrobatic af 11/10 https://t.co/KInss2PXyX,11,10,Rilo,951,3620,toy_poodle,
701889187134500865,This is Bilbo. He's not emotionally prepared to enter the water. 11/10 don't struggle Bilbo https://t.co/rH9SQgZUnQ,11,10,Bilbo,1294,3333,French_bulldog,
701601587219795968,This is Coopson. He's a Blingin Schnitzel. Built fence himself. One ear is slightly defective. 10/10 would still pet https://t.co/MWw3pVMhJA,10,10,Coopson,427,1977,Chihuahua,
701570477911896070,This is Yoda. He's a Zimbabwean Rutabaga. Freaks out if u stop scratching his belly. Incredibly self-centered. 9/10 https://t.co/yVdMsVYHIx,9,10,Yoda,870,2643,Yorkshire_terrier,
701545186879471618,Meet Millie. She's practicing her dive form for Rio. It's nearly perfect. Dedicated af. 10/10 go for gold pupper https://t.co/SDVkc4m96M,10,10,Millie,570,2516,Border_collie,pupper
700847567345688576,Meet Crouton. He's a Galapagos Boonwiddle. Has a legendary tongue (most Boonwiddles do). Excellent stuff 10/10 https://t.co/110Eeg7KW3,10,10,Crouton,463,2329,Rhodesian_ridgeback,
700747788515020802,We only rate dogs. Pls stop sending in non-canines like this Mongolian grass snake. This is very frustrating. 11/10 https://t.co/22x9SbCYCU,11,10,very,8635,21447,Great_Pyrenees,
700518061187723268,This is Vincent. He's the man your girl is with when she's not with you. 10/10 https://t.co/JQGMP7kzjD,10,10,Vincent,741,2455,American_Staffordshire_terrier,
700167517596164096,This is Dotsy. She's stuck as hell. 10/10 https://t.co/A0h4lnhU4s,10,10,Dotsy,676,2486,beagle,
700029284593901568,This is Coops. His ship is taking on water. Sound the alarm. Much distress. Requesting immediate assistance. 10/10 https://t.co/8Nuny4lLE3,10,10,Coops,543,1958,West_Highland_white_terrier,
700002074055016451,This is Thumas. He covered himself in nanners for maximum camouflage. It didn't work. I can still see u Thumas. 9/10 https://t.co/x0ZDlNqfb1,9,10,Thumas,1246,3104,Chihuahua,
699801817392291840,This is Cooper. He began to tear up when his bone was taken from him. 11/10 stay strong pupper https://t.co/qI8yvqKG02,11,10,Cooper,878,2839,golden_retriever,pupper
699788877217865730,Say hello to Nala. She's a Freckled High Bruschetta. Petable af. 12/10 https://t.co/5bjrIRqByp,12,10,Nala,480,2108,Border_terrier,
699775878809702401,Meet Fillup. Spaghetti is his main weakness. Also pissed because he's rewarded with cat treats 11/10 it'll be ok pup https://t.co/TEHu55ZQKD,11,10,Fillup,559,1849,Dandie_Dinmont,
699446877801091073,"This is Archie. He's undercover in all these pics. Not actually a bee, cow, or Hawaiian. Sneaky af. 12/10 https://t.co/9fojElzIxx",12,10,Archie,2445,5628,Pembroke,
699413908797464576,"Meet Miley. She's a Scandinavian Hollabackgirl. Incalculably fluffy, unamused af. 11/10 would squeeze aggressively https://t.co/6r4GFZY5WS",11,10,Miley,585,1969,Samoyed,
699370870310113280,Say hello to Calbert. He doesn't have enough legs. Wtf Calbert. Still havin a blast tho. 11/10 would pet extra well https://t.co/iNFIHvcVur,11,10,Calbert,403,1785,cairn,
699079609774645248,Meet Reagan. He's a Persnicketus Derpson. Great with kids. Permanently caught off guard. 8/10 https://t.co/A2j2StfNgL,8,10,Reagan,599,2309,schipperke,
698989035503689728,This is Oliver. He does toe touches in his sleep. 13/10 precious af https://t.co/3BrRIWjG35,13,10,Oliver,896,3140,Norfolk_terrier,
698953797952008193,Meet CeCe. She wanted to take a selfie before her first day as a lumberjack. 11/10 crushing traditional gender roles https://t.co/oW9XMYG3F4,11,10,CeCe,851,2529,Italian_greyhound,
698710712454139905,This is Cuddles. He's not entirely sure how doors work. 10/10 I believe in you Cuddles https://t.co/rKjK88D05Z,10,10,Cuddles,632,2324,Samoyed,
698703483621523456,This is Rusty. He has no respect for POULTRY products. Unbelievable af. 7/10 would still pet https://t.co/hEH19t1eFp,7,10,Rusty,348,1355,Brittany_spaniel,
698549713696649216,This is Claude. He's trying to be seductive but he forgot to turn on the fireplace. 9/10 damn it Claude https://t.co/EPdQquc1dG,9,10,Claude,577,2193,French_bulldog,
698355670425473025,This is Jessiga. She's a Tasmanian McCringleberry. Selfies make her uncomfortable. 10/10 would pet in time of need https://t.co/MrdPZz1CGk,10,10,Jessiga,412,1737,pug,
698342080612007937,This is Maximus. He's training for the tetherball world championship. The grind never stops. 11/10 (vid by @Amuly21) https://t.co/VmFfWMjNkp,11,10,Maximus,896,2133,boxer,
698262614669991936,This is Franklin. He's a yoga master. Trying to get rid of those rolls. Dedicated af. 11/10 keep it up pup https://t.co/S712MJXulD,11,10,Franklin,1847,4495,Italian_greyhound,
698195409219559425,Meet Beau &amp; Wilbur. Wilbur stole Beau's bed from him. Wilbur now has so much room for activities. 9/10 for both pups https://t.co/GPaoH5qWEk,9,10,Beau,5570,15837,Labrador_retriever,
698178924120031232,This is Lily. She accidentally dropped all her Kohl's cash overboard. Day officially ruined. 10/10 hang in there pup https://t.co/BJbtCqGwZK,10,10,Lily,694,2649,Chesapeake_Bay_retriever,
697990423684476929,This is Doug. He's a Draconian Jabbawockee. Rad tongue. Ears are borderline legendary 11/10 would pet with a purpose https://t.co/MVvbQW88Pv,11,10,Doug,1200,3091,Pembroke,
