tweet_id,text,rating_numerator,rating_denominator,name,retweets,favorites,breed,stage
697943111201378304,This is Cassie. She goes door to door trying to find the owner of this baguette. No luck so far. 10/10 https://t.co/e8bj97CisO,10,10,Cassie,629,2251,Great_Dane,
697270446429966336,This is Bentley. He got stuck on his 3rd homework problem. Picturing the best case scenario if he drops out. 10/10 https://t.co/7rS33sCKMS,10,10,Bentley,1750,4458,toy_poodle,
697259378236399616,"Please stop sending in saber-toothed tigers. This is getting ridiculous. We only rate dogs.
...8/10 https://t.co/iAeQNueou8",8,10,getting,927,3110,Great_Dane,
697255105972801536,Meet Charlie. He likes to kiss all the big milk dogs with the rad earrings. Passionate af. 10/10 just a great guy https://t.co/Oe0XSGmfoP,10,10,Charlie,1082,2893,Great_Dane,
696900204696625153,This is Rosie. She's a Benebark Cumberpatch. Sleepy af. 12/10 would snug for days https://t.co/NKuON5Al8i,12,10,Rosie,963,2978,Chihuahua,
696405997980676096,This is Berb. He just found out that they have made 31 Kidz Bop CD's. Downright terrifying. 7/10 hang in there Berb https://t.co/CIFLjiTFwZ,7,10,Berb,1074,3010,borzoi,
695794761660297217,This is Wyatt. His throne is modeled after him. 13/10 Wyatt is a very big deal https://t.co/PccQ1CFEDd,13,10,Wyatt,725,2983,Samoyed,
695629776980148225,Meet Calvin. He's proof that degrees mean absolutely nothing. 8/10 straighten up pup https://t.co/NIvxgSQ9BS,8,10,Calvin,1947,4298,Old_English_sheepdog,
695409464418041856,This is Bob. He just got back from his job interview and realized his ear was inside-out the whole time. 10/10 https://t.co/lORINwFXIV,10,10,Bob,3340,8182,pug,
695314793360662529,This is Colin. He really likes green beans. It's tearing his family apart. 10/10 please pray for Colin https://t.co/ioFy0cmK03,10,10,Colin,1337,3407,Maltese_dog,
695095422348574720,This is just a beautiful pupper good shit evolution. 12/10 https://t.co/2L8pI0Z2Ib,12,10,just,570,2510,papillon,pupper
695074328191332352,This is Lorenzo. He's educated af. Just graduated college. 11/10 poor pupper can't even comprehend his debt https://t.co/dH3GzcjCtQ,11,10,Lorenzo,1021,2672,Shih-Tzu,pupper
695051054296211456,"Meet Brian (pronounced ""Kirk""). He's not amused by ur churlish tomfoolery. Once u put him down you're done for. 6/10 https://t.co/vityMwPKKi",6,10,Brian,736,2491,Boston_bull,
694352839993344000,Meet OliviÃ©r. He takes killer selfies. Has a dog of his own. It leaps at random &amp; can't bark for shit. 10/10 &amp; 5/10 https://t.co/6NgsQJuSBJ,10,10,OliviÃ©r,560,1911,Australian_terrier,
694329668942569472,Meet Grady. He's very hungry. Too bad no one can find his food bowl. 9/10 poor pupper https://t.co/oToIkYnEGn,9,10,Grady,467,1877,boxer,pupper
694001791655137281,This is Chester. He's a Benefloof Cumberbark. Fabulous ears. Nifty shirt. Was probably on sale. Nice hardwood. 11/10 https://t.co/YoII7tWXMT,11,10,Chester,954,3214,Pembroke,
693942351086120961,This is Kobe. He's a Speckled Rorschach. Requests that someone holds his hand during car rides. 10/10 sick interior https://t.co/LCA6Fr3X2M,10,10,Kobe,341,1652,groenendael,
693642232151285760,Meet Freddery. He's a Westminster Toblerone. Seems to enjoy car rides. 9/10 would pat on the head approvingly https://t.co/6BS9XEip9a,9,10,Freddery,389,2408,Scottish_deerhound,
693280720173801472,This is Sadie and her 2 pups Shebang &amp; Ruffalo. Sadie says single parenting is challenging but rewarding. All 10/10 https://t.co/UzbhwXcLne,10,10,Sadie,1157,3154,Labrador_retriever,
693231807727280129,"This is Bodie. He's not proud of what he did, but it needed to be done. 9/10 eight days was a pretty good streak tbh https://t.co/bpZsGMqVVP",9,10,Bodie,693,2725,vizsla,
693155686491000832,This is Dunkin. He can only see when he's wet (tragic). 12/10 future heartbreaker https://t.co/At8Kxc5H9U,12,10,Dunkin,2983,7434,Shih-Tzu,
692905862751522816,This is Wally. He's being abducted by aliens. 10/10 poor pupper https://t.co/EiF659Bgjn,10,10,Wally,816,2290,Mexican_hairless,pupper
692894228850999298,Meet Tupawc. He's actually a Christian rapper. Doesn't even understand the concept of dollar signs. 10/10 great guy https://t.co/mCqgtqLDCW,10,10,Tupawc,735,2130,German_short-haired_pointer,
692568918515392513,This is Chester. He's been guarding this pumpkin since October. Dedicated af. Hat is nifty as hell. 12/10 would snug https://t.co/CFMjsn3P6B,12,10,Chester,1438,4108,golden_retriever,
692535307825213440,This is Amber. She's a Fetty Woof. 10/10 would pet in a heartbeat https://t.co/Dt360V2MYI,10,10,Amber,1269,2970,pug,
692530551048294401,Say hello to Cody. He's been to like 80 countries and is way more cultured than you. He wanted me to say that. 10/10 https://t.co/Iv3flDTpXu,10,10,Cody,382,1742,Siberian_husky,
692158366030913536,This is Edgar. He's a Sassafras Puggleflash. Nothing satisfies him. Not since the war. 10/10 cheer up pup https://t.co/1NgMb9BTWB,10,10,Edgar,741,2018,pug,
692017291282812928,This is Kingsley Wellensworth III. He owns 7 range rovers. Has a cardigan collection. Would rather be sailing. 9/10 https://t.co/BE4ahQ0IO2,9,10,Kingsley,893,2729,Tibetan_terrier,
691675652215414786,This is Richie and Plip. They are the best of pals. Do everything together. 10/10 for both https://t.co/KMdwNgONkV,10,10,Richie,473,1840,Chihuahua,
691459709405118465,Say hello to Leo. He's a Fallopian Puffalope. Precious af. 12/10 would cuddle https://t.co/LZEi0DpRsH,12,10,Leo,1053,3810,Shetland_sheepdog,
691444869282295808,This is Bailey. She likes flowers. 12/10 https://t.co/YBENhr24FV,12,10,Bailey,782,2483,Bernese_mountain_dog,
691321916024623104,This is Molly. She's a Peruvian Niddlewog. Loves her new hat. 11/10 would totally pet https://t.co/g4fiS8A9Ab,11,10,Molly,619,2437,Rottweiler,
690735892932222976,Say hello to Peaches. She's a Dingleberry Zanderfloof. 13/10 would caress lots https://t.co/YrhkrTsoTt,13,10,Peaches,1183,3575,golden_retriever,
690728923253055490,This is Vinscent. He was just questioned about his recent credit card spending. 8/10 https://t.co/qOD4G19A2u,8,10,Vinscent,480,2042,kuvasz,
690597161306841088,This is Lolo. She's America af. Behind in science &amp; math but can say whatever she wants on Twitter. 11/10 ...Merica https://t.co/Nwi3SYe8KA,11,10,Lolo,563,1829,Lhasa,
690400367696297985,"This is Eriq. His friend just reminded him of last year's super bowl. Not cool friend
10/10 for Eriq
6/10 for friend https://t.co/PlEXTofdpf",10,10,Eriq,420,1785,Pembroke,
690374419777196032,This is Phred. He's an Albanian Flepperkush. Tongue is rather impressive if I'm honest. Perhaps even legendary 11/10 https://t.co/VpfFCKE28C,11,10,Phred,790,3041,kuvasz,
690360449368465409,Stop sending in lobsters. This is the final warning. We only rate dogs. Thank you... 9/10 https://t.co/B9ZXXKJYNx,9,10,the,817,2504,pug,
689999384604450816,This is Covach. He's trying to melt the snow. 10/10 we all believe in you buddy https://t.co/fgMaP2zDMt,10,10,Covach,338,1336,standard_poodle,
689905486972461056,"Say hello to Gizmo. He's quite the pupper. Confused by bed, but agile af. Can barely catch on camera. 11/10 so quick https://t.co/IE4ZblyZRY",11,10,Gizmo,647,2318,Pomeranian,pupper
689877686181715968,This is Durg. He's trying to conquer his fear of trampolines. 9/10 it's not working https://t.co/5iH08ltkoe,9,10,Durg,1076,2861,Old_English_sheepdog,
689835978131935233,Meet Fynn &amp; Taco. Fynn is an all-powerful leaf lord and Taco is in the wrong place at the wrong time. 11/10 &amp; 10/10 https://t.co/MuqHPvtL8c,11,10,Fynn,703,2056,collie,
689661964914655233,Meet Luca. He's a Butternut Scooperfloof. Glorious tongue. 12/10 would pet really well https://t.co/VcxZQPNZaV,12,10,Luca,872,3052,Italian_greyhound,
689623661272240129,This is Lucy. She's terrified of the stuffed billed dog. 10/10 stay strong pupper https://t.co/QnvSjjyh7n,10,10,Lucy,596,2090,toy_poodle,pupper
689517482558820352,This is Carl. He just wants to make sure you're having a good day. 12/10 just a swell pup https://t.co/Wk3XCnmDvm,12,10,Carl,1329,3206,Pembroke,
689283819090870273,Say hello to Chipson. He's aerodynamic af. No eyes (devastating). 9/10 would make sure he didn't bump into stuff https://t.co/V62rIva61J,9,10,Chipson,1029,3079,Scotch_terrier,
689280876073582592,This is Herald. He wants you to know he could steal your girl at any moment. 10/10 https://t.co/JR7hLnlgeS,10,10,Herald,655,1867,Chihuahua,
689275259254616065,Meet Lucky. He was showing his friends an extreme pogo stick trick when he completely lost control. 10/10 still rad https://t.co/K55XrIoePl,10,10,Lucky,233,1083,American_Staffordshire_terrier,
689143371370250240,Meet Trip. He likes wearing costumes that aren't consistent with the season to screw with people 10/10 tricky pupper https://t.co/40w7TI5Axv,10,10,Trip,468,1905,English_springer,pupper
688828561667567616,Say hello to Brad. His car probably has a spoiler. Tan year round. Likes your insta pic but doesn't text back. 9/10 https://t.co/dfCCK3tWfr,9,10,Brad,338,1301,Cardigan,
688789766343622656,Meet Pubert. He's a Kerplunk Rumplestilt. Cannot comprehend flower. Flawless tongue. 8/10 would pat head approvingly https://t.co/2TWxg0rgyG,8,10,Pubert,621,2095,American_Staffordshire_terrier,
688547210804498433,This is FrÃ¶nq. He got caught stealing a waffle. Damn it FrÃ¶nq. 9/10 https://t.co/7ycWCUrjmZ,9,10,FrÃ¶nq,652,2450,papillon,
688385280030670848,This is Louis. He's takes top-notch selfies. 12/10 would snapchat with https://t.co/vz2DukO0th,12,10,Louis,4176,8733,golden_retriever,
688064179421470721,This is Kilo. He's a Pouncing Brioche. Really likes snow. 11/10 https://t.co/GS76SfkraY,11,10,Kilo,337,1640,Eskimo_dog,
687826841265172480,This is Louis. He's a rollercoaster of emotions. Incalculably fluffy. 12/10 would pet firmly https://t.co/17RGvOZO9P,12,10,Louis,1043,2577,Pomeranian,
687807801670897665,Meet Trooper &amp; Maya. Trooper protects Maya from bad things like dognappers and Comcast. So touching. 11/10 for both https://t.co/c98k1IoZKy,11,10,Trooper,672,2242,Staffordshire_bullterrier,
687704180304273409,Say hello to Blakely. He thinks that's a hat. Silly pupper. That's a nanner. 9/10 https://t.co/UwOV1jqKRt,9,10,Blakely,785,2291,miniature_pinscher,pupper
687664829264453632,Meet Opal. He's a Belgian Dijon Poofster. Upset because his hood makes him look like blond Justin Timberlake. 11/10 https://t.co/IAt3jRZ5ez,11,10,Opal,479,1834,pug,
687494652870668288,This is Marq. He stole this car. 7/10 wtf Marq? https://t.co/MHScqo5l8c,7,10,Marq,540,1795,Rottweiler,
687460506001633280,This is Kramer. He's a Picasso Tortellini. Tie couldn't be more accurate. Confident af. Runs his own business. 10/10 https://t.co/jIcVW0xxmH,10,10,Kramer,502,1943,Boston_bull,
687317306314240000,This is Tyrone. He's a leaf wizard. Self-motivated. No eyes (tragic). Inspirational af. 11/10 enthusiasm is tangible https://t.co/pRp1Npucbz,11,10,Tyrone,8557,19026,Shih-Tzu,
687127927494963200,Meet Gordon. He's an asshole. 9/10 would still pet https://t.co/a34N7QwKbb,9,10,Gordon,2100,5095,pug,
687109925361856513,This is Baxter. He looks like a fun dog. Prefers action shots. 11/10 the last one is impeccable https://t.co/LHcH1yhhIb,11,10,Baxter,2291,5483,borzoi,
686683045143953408,This is Mona. She's a Yarborough Splishnsplash. Lost body during Nam. 11/10 revolutionary pupper https://t.co/pgD6h0yhgz,11,10,Mona,754,2661,Norwich_terrier,pupper
686618349602762752,This is Olivia. She just saw an adult wearing crocs. 11/10 poor pupper. No one should witness such a thing https://t.co/yJVTi1DjJc,11,10,Olivia,1269,3488,Rottweiler,pupper
686606069955735556,"Meet Horace. He was practicing his levitation, minding his own business when a rogue tennis ball spooked him. 10/10 https://t.co/tB9xYjMyZd",10,10,Horace,506,1788,Labrador_retriever,
686386521809772549,Say hello to Crimson. He's a Speckled Winnebago. Main passions are air hockey &amp; parkour. 11/10 would pet thoroughly https://t.co/J5aI7SjzDc,11,10,Crimson,823,3061,Yorkshire_terrier,
686377065986265092,Meet Birf. He thinks he's gone blind. 10/10 very frightened pupper https://t.co/oDkspjNWYX,10,10,Birf,530,2092,German_shepherd,pupper
686050296934563840,This is FlÃ¡vio. He's a Macedonian Poppycock. 97% floof. Jubilant af. 11/10 personally I'd pet the hell out of https://t.co/BUyX7isHRg,11,10,FlÃ¡vio,682,2101,Pomeranian,
685973236358713344,This is Lorelei. She's contemplating her existence and the eventual heat death of the universe. 11/10 very majestic https://t.co/xbUoULOIS8,11,10,Lorelei,489,1978,Siberian_husky,
685943807276412928,This is the newly formed pupper a capella group. They're just starting out but I see tons of potential. 8/10 for all https://t.co/wbAcvFoNtn,8,10,the,550,1532,papillon,pupper
685906723014619143,This is Olive. He's stuck in a sleeve. 9/10 damn it Olive https://t.co/NnLjg6BgyF,9,10,Olive,2658,7041,Yorkshire_terrier,
685663452032069632,"Meet Brooks. He's confused by the almighty ball of tennis. 12/10 

(vid by @PDolan37) https://t.co/AcVWe39nmM",12,10,Brooks,1365,3037,Chesapeake_Bay_retriever,
685641971164143616,This is Otis. He just passed a cop while going 61 in a 45. Very nervous pupper. 7/10 https://t.co/jJS8qQeuNO,7,10,Otis,708,2747,Lakeland_terrier,pupper
685321586178670592,This is Rocky. He sleeps like a psychopath. 10/10 quality tongue slip https://t.co/MbgG95mUdu,10,10,Rocky,590,2496,Boston_bull,
685307451701334016,Say hello to Petrick. He's an Altostratus Floofer. Just had a run in with a trash bag. Groovy checkered floor. 11/10 https://t.co/rwW7z1JAOF,11,10,Petrick,409,1963,Pomeranian,floofer
685268753634967552,This is Hubertson. He's a Carmel Haberdashery. Enjoys long summer days on his boat. Very peaceful pupper. 10/10 https://t.co/vzCl35fKlZ,10,10,Hubertson,1110,2918,pug,pupper
685169283572338688,Meet Gerbald. He just found out he's adopted. Poor pupper. Snazzy tongue tho. 11/10 would hold close in time of need https://t.co/UfGkB9Wrud,11,10,Gerbald,1320,3873,Bernese_mountain_dog,pupper
684940049151070208,This is Oreo. She's a photographer and a model. Living a double pupple life. 12/10 such talent much cute would pet https://t.co/zNeLxJeAoL,12,10,Oreo,966,3012,Border_collie,
684926975086034944,Meet Bruiser &amp; Charlie. They are the best of pals. Been through it all together. Both 11/10. 1 like=1 friendship https://t.co/PEXHuvSVD4,11,10,Bruiser,432,3298,Labrador_retriever,
684902183876321280,This is Perry. He's an Augustus Gloopster. Very condescending. Makes up for it with the sneaky tongue slip. 11/10 https://t.co/JVvIrUmTkR,11,10,Perry,487,1756,Pembroke,
684800227459624960,Meet Theodore. He's dapper as hell. Probably owns horses. Uses 'summer' as a verb. Often quotes philosophers. 11/10 https://t.co/J3Ld4fRbSy,11,10,Theodore,933,2564,miniature_schnauzer,
684481074559381504,Meet Pippa. She's an Elfin High Feta. Compact af. Easy to transport. Great for vacations. 10/10 would keep in pocket https://t.co/nBtDeZ4yAb,10,10,Pippa,1102,3652,Chihuahua,
684460069371654144,This is Jeph. He's a Western Sagittarius Dookmarriot. Frightened by leaf. Caught him off guard. 10/10 calm down Jeph https://t.co/bicyOV6lju,10,10,Jeph,517,1861,Labrador_retriever,
684241637099323392,This is Obi. He got camera shy. 12/10 https://t.co/feiPiq7z94,12,10,Obi,3031,7636,Pembroke,
684195085588783105,This is Tino. He really likes corndogs. 9/10 https://t.co/cUxGtnBfc2,9,10,Tino,469,1793,Chihuahua,
684177701129875456,This is Kulet. She's very proud of the flower she picked. Loves it dearly. 10/10 now I want a flower https://t.co/myUUwqJIs7,10,10,Kulet,609,1903,chow,
684097758874210310,Say hello to Lupe. This is how she sleeps. 10/10 impressive really https://t.co/Fz6iZWlk8C,10,10,Lupe,1334,3870,Labrador_retriever,
683857920510050305,Meet Sadie. She fell asleep on the beach and her friends buried her. 10/10 can't trust fellow puppers these days https://t.co/LoKVvc1xAW,10,10,Sadie,1048,3599,bluetick,
683852578183077888,"Say hello to Tiger. He's a penbroke (little dog pun for ya, no need to applaud I know it was good) 10/10 good dog https://t.co/Yei0HzS3JN",10,10,Tiger,324,1828,toy_poodle,
683773439333797890,This is Buddy. He's gaining strength. Currently an F4 tornado with wind speeds up to 260mph. Very devastating. 9/10 https://t.co/qipZbshNsR,9,10,Buddy,1252,3137,miniature_pinscher,
683742671509258241,Meet Sebastian. He's a womanizer. Romantic af. Always covered in flower petals. Also a poet. 11/10 dreamy as hell https://t.co/eoL1bCpWCg,11,10,Sebastian,3085,6090,Pembroke,
683498322573824003,This is Griffin. He's desperate for both a physical and emotion connection. 11/10 I'd hug the hell out of Griffin https://t.co/ObWcOEekt0,11,10,Griffin,901,2998,Airedale,
683481228088049664,Meet Banjo. He's a Peppercorn Shoop Da Whoop. Nails look lethal. Skeptical of luminescent orb 11/10 stay woke pupper https://t.co/H7NZFumpKq,11,10,Banjo,931,2516,keeshond,pupper
683391852557561860,"Say hello to Jack (pronounced ""Kevin""). He's a Virgo Episcopalian. Can summon rainbows. 11/10 magical as hell https://t.co/YHXrdUTHd6",11,10,Jack,2230,7205,French_bulldog,
683142553609318400,Meet Brandy. She's a member of the Bloods. Menacing criminal pupper. Soft spot for flowers tho. 9/10 pet w caution https://t.co/hhIA3coiAJ,9,10,Brandy,971,2697,Leonberg,pupper
683111407806746624,This is Larry. He thought the New Year's parties were tonight. 10/10 poor pupper. Maybe next year https://t.co/h3X0jK8MVM,10,10,Larry,843,3202,cocker_spaniel,pupper
683030066213818368,This is Lulu. She's contemplating all her unreached 2015 goals and daydreaming of a more efficient tomorrow. 10/10 https://t.co/h3ScYuz77J,10,10,Lulu,692,2036,boxer,
682750546109968385,Meet Taco. He's a speckled Garnier Fructis. Loves to shadow box. Ears out of control. Friend clearly impressed 9/10 https://t.co/85X1GHohFr,9,10,Taco,408,1426,English_setter,
682662431982772225,Meet Joey and Izzy. Joey only has one ear that works and Izzy wants 2015 to be over already. Both great pups. 11/10s https://t.co/WgQTIQ93BB,11,10,Joey,1008,2874,beagle,
682393905736888321,This is Kreg. He's riding an invisible jet ski. 11/10 that's downright legendary https://t.co/BA5AV5dx6Y,11,10,Kreg,614,2111,vizsla,
682389078323662849,"Meet Brody. He's a Downton Abbey Falsetto. Addicted to grating cheese. He says he can stop but we know he can't
9/10 https://t.co/vBeiQq6SaZ",9,10,Brody,438,1577,curly-coated_retriever,
682259524040966145,Meet Jax. He's an Iglesias Hufflepoof. Quite the jokester. Takes it too far sometimes. Can be very hurtful. 9/10 https://t.co/i5TeG0KYcW,9,10,Jax,1106,3890,Siberian_husky,
682032003584274432,This is Ulysses. He likes holding hands and his eyes are magic. 11/10 https://t.co/gPmJHmtgak,11,10,Ulysses,1854,6190,schipperke,
681981167097122816,This is Jimothy. He's a Trinidad Poliwhirl. Father was a velociraptor. Exceptionally unamused. 12/10 would adopt https://t.co/VwdIk0OwVx,12,10,Jimothy,952,2645,Labrador_retriever,
681891461017812993,Say hello to Charlie. He's scholarly af. Quite intimidating with all his pupper knowledge 10/10 even built that fire https://t.co/9KThv6z8u5,10,10,Charlie,764,2322,Chihuahua,pupper
681694085539872773,This is Bo. He's a Benedoop Cumbersnatch. Seems frustrated with own feet. Portable as hell. 11/10 very solid pupper https://t.co/TONMhRoQh7,11,10,Bo,3782,12071,toy_poodle,pupper
681654059175129088,This is Toffee. He's a happy pupper. Appears dangerously fluffy. Extraordinarily spherical. 12/10 would pet firmly https://t.co/oEXEKt3MHu,12,10,Toffee,840,2469,Pomeranian,pupper
681579835668455424,This is Apollo. He thought you weren't coming back so he had a mental breakdown. 8/10 we've all been there https://t.co/ojUBrDCHLT,8,10,Apollo,1211,3325,Rottweiler,
681523177663676416,This is Carly. She's actually 2 dogs fused together. Very innovative. Probably has superpowers. 12/10 for double dog https://t.co/GQn2IopLud,12,10,Carly,5329,13413,Norfolk_terrier,
681320187870711809,This is Glacier. He's a very happy pup. Loves to sing in the sunlight. 11/10 https://t.co/jTBPqKgkz7,11,10,Glacier,689,2475,Samoyed,
681297372102656000,"This is actually a lion. We only rate dogs. For the last time please only send dogs. Thank u.
12/10 would still pet https://t.co/Pp26dMQxap",12,10,actually,881,3026,Lhasa,
681281657291280384,Meet Sarge. His parents signed him up for dancing lessons but his true passion is roller coasters 11/10 very petable https://t.co/KvVoBIgkje,11,10,Sarge,1025,3044,Saint_Bernard,
681261549936340994,Say hello to Panda. He's a Quackadilly Shooster. Not amused by your fake ball throwing motion. 9/10 would hug lots https://t.co/wL1iDvbcVk,9,10,Panda,246,1363,Tibetan_terrier,
681193455364796417,This is Aspen. He's astronomically fluffy. I wouldn't stop petting this dog if the world was ending around me 11/10 https://t.co/oBlgL9nxpx,11,10,Aspen,1379,3481,Pomeranian,
680940246314430465,This is Alice. She's an idiot. 4/10 https://t.co/VQXdwJfkyS,4,10,Alice,964,2994,soft-coated_wheaten_terrier,
680934982542561280,Say hello to Sadie. She's a Tortellini Sidewinder. Very jubilant pup. Seems loyal. Leaves on point. 10/10 petable af https://t.co/g2bTu4ayPl,10,10,Sadie,406,1960,Labrador_retriever,
680913438424612864,Meet Griswold. He's dapper as hell. Already pumped for next Christmas. 11/10 https://t.co/5NrpNDyFzN,11,10,Griswold,576,2265,Pomeranian,
680889648562991104,This is Cheesy. It's her birthday. She's patiently waiting to eat her party muffin. 9/10 happy birthday pup https://t.co/cH2H7mch2H,9,10,Cheesy,340,1655,Shetland_sheepdog,
680836378243002368,This is Ellie. She's secretly ferocious. 12/10 very deadly pupper https://t.co/BF4BW8LUgb,12,10,Ellie,1227,3241,Pembroke,pupper
680609293079592961,This is Brody. That is his chair. He loves his chair. Never leaves it. 9/10 might be stuck actually https://t.co/WvJRg0XJit,9,10,Brody,648,2468,French_bulldog,
680497766108381184,Meet Percy. He's a Latvian Yuletide Heineken. Refuses to take off sweater. Kinda feisty. 12/10 would keep in pocket https://t.co/QGM5Fcuv7s,12,10,Percy,1780,3961,Chihuahua,
680473011644985345,"This is Hector. He thinks he's a hammer. Silly Hector. You're a pupper, not a hammer. 10/10 https://t.co/OdUFuZIXiI",10,10,Hector,698,2394,Lakeland_terrier,pupper
680161097740095489,Meet Goliath. He's an example of irony. Head is phenomenally round. Wants to be an ornament. 12/10 would hug gently https://t.co/72Dil0Aktw,12,10,Goliath,686,2190,bluetick,
680145970311643136,Say hello to Kawhi. He was doing fine until his hat fell off. He got it back though. 10/10 deep breaths pupper https://t.co/N5pM6WBx7e,10,10,Kawhi,1610,3404,miniature_poodle,pupper
680130881361686529,This is Reggie. His Santa hat is a little big. 10/10 he's still having fun https://t.co/w0dcGXq7qK,10,10,Reggie,876,2156,Maltese_dog,
680115823365742593,This is Ozzy. He woke up 2 minutes before he had to be ready for the Christmas party. 9/10 classic Ozzy https://t.co/Kt9vmw0Fap,9,10,Ozzy,848,2556,pug,
679844490799091713,This is Willie. He's floating away and needs your assistance. Please someone help Willie. 10/10 https://t.co/MJqygWqt8X,10,10,Willie,704,2235,Airedale,
679777920601223168,This is Rinna. She's melting. 10/10 get inside pupper https://t.co/PA0czwucsb,10,10,Rinna,1016,2918,bloodhound,pupper
679722016581222400,This is Mike. He is a Jordanian Frito Pilates. Frowning because he can't see directly in front of him. 8/10 https://t.co/NL5QJwdEpF,8,10,Mike,437,1568,boxer,
679511351870550016,Say hello to William. He makes fun of others because he's terrified of his own deep-seated insecurities. 7/10 https://t.co/bwuV6FlRxr,7,10,William,1169,3142,Chihuahua,
679475951516934144,This is Evy. She doesn't want to be a Koala. 9/10 https://t.co/VITeF0Kl9L,9,10,Evy,597,1964,Maltese_dog,
679462823135686656,Meet Hurley. He's the curly one. He hugs every other dog he sees during his walk. 11/10 for spreading the love https://t.co/M6vqkt2GKV,11,10,Hurley,17329,29459,toy_poodle,
679158373988876288,This is Rubio. He has too much skin. 11/10 https://t.co/NLOHmlENag,11,10,Rubio,7412,19834,pug,
679132435750195208,This is Louis. He's a river dancer. His friends think it's badass. All are very supportive. 10/10 for Louis https://t.co/qoIvjKMY58,10,10,Louis,1063,2776,Scottish_deerhound,
679111216690831360,This is officially the greatest yawn of all time. 12/10 https://t.co/4R0Cc0sLVE,12,10,officially,2383,5559,kelpie,
678969228704284672,Meet Lola. She's a Metamorphic Chartreuse. Plays with her food. Insubordinate and churlish. Exquisite hardwood 11/10 https://t.co/etpBNXwN7f,11,10,Lola,420,1532,Labrador_retriever,
678798276842360832,This is Linda. She fucking hates trees. 7/10 https://t.co/blaY85FIxR,7,10,Linda,1062,3223,Airedale,
678774928607469569,This is Tug. He's not required to wear the cone he just wants his voice to project more clearly. 11/10 https://t.co/Sp739Ou2qx,11,10,Tug,838,2618,Pembroke,
678764513869611008,"Meet Wilson. He got caught humping the futon. He's like ""dude, help me out here"" 10/10 I'd help Wilson out https://t.co/m6XoclB0qv",10,10,Wilson,431,1514,Irish_terrier,
678755239630127104,This is Dash. He didn't think the water would be that cold. Damn it Dash it's December. Think a little. 10/10 https://t.co/NqcOwG8pxW,10,10,Dash,3005,6612,malamute,
678643457146150913,Meet Grizz. He just arrived. Couldn't wait until Christmas. Worried bc he saw the swastikas on the carpet. 10/10 https://t.co/QBGwYrT7rv,10,10,Grizz,368,1917,Labrador_retriever,
678424312106393600,This is Crystal. She's a shitty fireman. No sense of urgency. People could be dying Crystal. 2/10 just irresponsible https://t.co/rtMtjSl9pz,2,10,Crystal,2346,5096,Maltese_dog,
678410210315247616,Say hello to Jerome. He can shoot french fries out of his mouth at insane speeds. Deadly af. 10/10 https://t.co/dIy88HwrX8,10,10,Jerome,1649,3918,schipperke,
