tweet_id,text,rating_numerator,rating_denominator,name,retweets,favorites,breed,stage
892177421306343426,"This is Tilly. She's just checking pup on you. Hopes you're doing ok. If not, she's available for pats, snugs, boops, the whole bit. 13/10 https://t.co/0Xxu71qeIV",13,10,Tilly,5380,29849,Chihuahua,
891815181378084864,This is Archie. He is a rare Norwegian Pouncing Corgo. Lives in the tall grass. You never know when one may strike. 12/10 https://t.co/wUnZnhtVJB,12,10,Archie,3545,22466,Chihuahua,
891327558926688256,"This is Franklin. He would like you to stop calling him ""cute."" He is a very fierce shark and should be respected as such. 12/10 #BarkWeek https://t.co/AtUZn91f7f",12,10,Franklin,7909,35933,basset,
890971913173991426,"Meet Jax. He enjoys ice cream so much he gets nervous around it. 13/10 help Jax enjoy more things by clicking below

https://t.co/Zr4hWfAs1H https://t.co/tVJBRMnhxl",13,10,Jax,1705,10559,Appenzeller,
890609185150312448,This is Zoey. She doesn't want to be one of the scary sharks. Just wants to be a snuggly pettable boatpet. 13/10 #BarkWeek https://t.co/9TwLuAGH0b,13,10,Zoey,3691,24979,Irish_terrier,
890240255349198849,This is Cassie. She is a college pup. Studying international doggo communication and stick theory. 14/10 so elegant much sophisticate https://t.co/t1bfwz5S2A,14,10,Cassie,6210,28485,Pembroke,doggo
890006608113172480,This is Koda. He is a South Australian deckshark. Deceptively deadly. Frighteningly majestic. 13/10 would risk a petting #BarkWeek https://t.co/dVPW0B0Mme,13,10,Koda,6265,27502,Samoyed,
889880896479866881,This is Bruno. He is a service shark. Only gets out of the water to assist you. 13/10 terrifyingly good boy https://t.co/u1XPQMl29g,13,10,Bruno,4246,25014,French_bulldog,
889638837579907072,This is Ted. He does his best. Sometimes that's not enough. But it's ok. 12/10 would assist https://t.co/f8dEDcrKSR,12,10,Ted,3800,24102,French_bulldog,
889531135344209921,This is Stuart. He's sporting his favorite fanny pack. Secretly filled with bones only. 13/10 puppared puppo #BarkWeek https://t.co/y70o6h3isq,13,10,Stuart,1915,13592,golden_retriever,puppo
889278841981685760,This is Oliver. You're witnessing one of his many brutal attacks. Seems to be playing with his victim. 13/10 fr*ckin frightening #BarkWeek https://t.co/WpHvrQedPb,13,10,Oliver,4532,22523,whippet,
888917238123831296,This is Jim. He found a fren. Taught him how to sit like the good boys. 12/10 for both https://t.co/chxruIOUJN,12,10,Jim,3829,26105,golden_retriever,
888804989199671297,This is Zeke. He has a new stick. Very proud of it. Would like you to throw it for him without taking it. 13/10 would do my best https://t.co/HTQ77yNQ5K,13,10,Zeke,3609,22873,golden_retriever,
888554962724278272,This is Ralphus. He's powering up. Attempting maximum borkdrive. 13/10 inspirational af https://t.co/YnYAFCTTiK,13,10,Ralphus,2935,17646,Siberian_husky,
888078434458587136,This is Gerald. He was just told he didn't get the job he interviewed for. A h*ckin injustice. 12/10 didn't want the job anyway https://t.co/DK7iDPfuRX,12,10,Gerald,2957,19481,French_bulldog,
887705289381826560,This is Jeffrey. He has a monopoly on the pool noodles. Currently running a 'boop for two' midweek sale. 13/10 h*ckin strategic https://t.co/PhrUk20Q64,13,10,Jeffrey,4620,27089,basset,
887473957103951883,This is Canela. She attempted some fancy porch pics. They were unsuccessful. 13/10 someone help her https://t.co/cLyzpcUcMX,13,10,Canela,15314,61298,Pembroke,
886983233522544640,This is Maya. She's very shy. Rarely leaves her cup. 13/10 would find her an environment to thrive in https://t.co/I6oNy0CgiT,13,10,Maya,6475,30945,Chihuahua,
886736880519319552,"This is Mingus. He's a wonderful father to his smol pup. Confirmed 13/10, but he needs your help

https://t.co/bVi0Yr4Cff https://t.co/ISvKOSkd5b",13,10,Mingus,2697,10680,kuvasz,
886366144734445568,This is Roscoe. Another pupper fallen victim to spontaneous tongue ejections. Get the BlepiPen immediate. 12/10 deep breaths Roscoe https://t.co/RGE08MIJox,12,10,Roscoe,2688,18893,French_bulldog,pupper
886258384151887873,This is Waffles. His doggles are pupside down. Unsure how to fix. 13/10 someone assist Waffles https://t.co/xZDA9Qsq1O,13,10,Waffles,5385,25017,pug,
885984800019947520,Viewer discretion advised. This is Jimbo. He will rip ur finger right h*ckin off. Other dog clearly an accessory. 12/10 pls pet with caution https://t.co/BuveP0uMF1,12,10,Jimbo,5728,29125,Blenheim_spaniel,
885528943205470208,This is Maisey. She fell asleep mid-excavation. Happens to the best of us. 13/10 would pat noggin approvingly https://t.co/tp1kQ8i9JF,13,10,Maisey,5440,32156,pug,
884925521741709313,"This is Earl. He found a hat. Nervous about what you think of it. 12/10 it's delightful, Earl https://t.co/MYJvdlNRVa",12,10,Earl,15333,68587,Italian_greyhound,
884876753390489601,This is Lola. It's her first time outside. Must test the earth and taste the atmosphere. 13/10 you're doing great Lola https://t.co/74TKAUsLkO,13,10,Lola,4752,24859,chow,
884562892145688576,This is Kevin. He's just so happy. 13/10 what is your secret Kevin https://t.co/1r4MFCbCX5,13,10,Kevin,3990,21713,pug,
884162670584377345,Meet Yogi. He doesn't have any important dog meetings today he just enjoys looking his best at all times. 12/10 for dangerously dapper doggo https://t.co/YSI00BzTBZ,12,10,Yogi,2535,18262,German_shepherd,doggo
883838122936631299,This is Noah. He can't believe someone made this mess. Got the vacuum out for you though. Offered to help clean pup. 12/10 super good boy https://t.co/V85xujjDDY,12,10,Noah,2916,19540,Doberman,
883482846933004288,"This is Bella. She hopes her smile made you smile. If not, she is also offering you her favorite monkey. 13.5/10 https://t.co/qjrljjt948",13.5,10,Bella,8419,40962,golden_retriever,
883360690899218434,Meet Grizzwald. He may be the floofiest floofer I ever did see. Lost eyes saving a schoolbus from a volcano erpuption. 13/10 heroic as h*ck https://t.co/rf661IFEYP,13,10,Grizzwald,3138,20308,chow,floofer
882992080364220416,This is Rusty. He wasn't ready for the first pic. Clearly puppared for the second. 13/10 confirmed great boy https://t.co/tyER0KpdXj,13,10,Rusty,3293,21355,Eskimo_dog,
882762694511734784,This is Gus. He's quite the cheeky pupper. Already perfected the disinterested wink. 12/10 would let steal my girl https://t.co/D43I96SlVu,12,10,Gus,4173,25237,Labrador_retriever,pupper
882627270321602560,This is Stanley. He has his first swim lesson today. Doggle straps adjusted. Ready to go. 13/10 Phelps is nervous (IG: stanleythe_corgi) https://t.co/Nx52PGwH94,13,10,Stanley,5175,25073,Pembroke,
882268110199369728,This is Alfy. You're witnessing his first watermelon experience. I think it was a success. 13/10 happy 4th Alfy ðŸ‡ºðŸ‡¸ https://t.co/fYP5RlutfA,13,10,Alfy,9854,39920,golden_retriever,
881906580714921986,This is Rey. He's a Benebop Cumberfloof. 12/10 dangerously pettable https://t.co/503CgWbhxQ,12,10,Rey,2902,21815,Weimaraner,
881666595344535552,This is Gary. He couldn't miss this puppertunity for a selfie. Flawless focusing skills. 13/10 would boop intensely https://t.co/7CSWCl8I6s,13,10,Gary,9130,45370,Saluki,
880465832366813184,This is Bella. She had her first beach experience this morning. Complete success. 12/10 would perform a sandy boop https://t.co/4VsFysDmiw,12,10,Bella,5304,25445,golden_retriever,
880221127280381952,Meet Jesse. He's a Fetty Woof. His tongue ejects without warning. A true bleptomaniac. 12/10 would snug well https://t.co/fUod0tVmvK,12,10,Jesse,3549,24105,Chihuahua,
879862464715927552,This is Romeo. He would like to do an entrance. Requesting your immediate assistance. 13/10 https://t.co/Qh5aEkRQm9,13,10,Romeo,2980,20055,basset,
879492040517615616,This is Bailey. He thinks you should measure ear length for signs of growth instead. 12/10 https://t.co/IxM9IMKQq8,12,10,Bailey,2689,21089,German_short-haired_pointer,
879415818425184262,This is Duddles. He did an attempt. 13/10 someone help him (vid by Georgia Felici) https://t.co/UDT7ZkcTgY,13,10,Duddles,38183,94536,English_springer,
879008229531029506,This is Beau. That is Beau's balloon. He takes it everywhere. 13/10 would protect at all costs https://t.co/YDtpCjIPKN,13,10,Beau,2290,17084,vizsla,
878776093423087618,This is Snoopy. He's a proud #PrideMonthPuppo. Impeccable handwriting for not having thumbs. 13/10 would love back #PrideMonth https://t.co/lNZwgNO4gS,13,10,Snoopy,3505,17430,Italian_greyhound,puppo
878281511006478336,"Meet Shadow. In an attempt to reach maximum zooming borkdrive, he tore his ACL. Still 13/10 tho. Help him out below

https://t.co/245xJJElsY https://t.co/lUiQH219v6",13,10,Shadow,1091,6915,basset,
878057613040115712,This is Emmy. She was adopted today. Massive round of pupplause for Emmy and her new family. 14/10 for all involved https://t.co/cwtWnHMVpe,14,10,Emmy,5842,37780,French_bulldog,
877736472329191424,This is Aja. She was just told she's a good dog. Suspicions confirmed. 13/10 would tell again https://t.co/lsPyyAiF1r,13,10,Aja,16146,70653,Chesapeake_Bay_retriever,
877556246731214848,This is Penny. She's both pupset and fired pup. Not pleased w your barbaric attempts at cleanliness. 12/10 would enjoy more shampoo options https://t.co/OYdDlfOGXP,12,10,Penny,3228,20321,basset,
877316821321428993,"Meet Dante. At first he wasn't a fan of his new raincoat, then he saw his reflection. H*ckin handsome. 13/10 for water resistant good boy https://t.co/SHRTIo5pxc",13,10,Dante,4437,24607,Saluki,
877201837425926144,This is Nelly. He graduated with his dogtorate today. Wants to know if you're proud of him. 12/10 would give congratulatory boop https://t.co/4g4cfj3P4Y,12,10,Nelly,4719,24279,Pembroke,
876838120628539392,This is Ginger. She's having a ruff Monday. Too many pupper things going on. H*ckin exhausting. 12/10 would snug passionately https://t.co/j211oCDRs6,12,10,Ginger,2853,18545,bloodhound,pupper
876484053909872640,This is Benedict. He wants to thank you for this delightful urban walk. Hopes you know he loves you. 13/10 super duper good boy https://t.co/26BXueUgbs,13,10,Benedict,2038,16861,golden_retriever,
876120275196170240,"Meet Venti, a seemingly caffeinated puppoccino. She was just informed the weekend would include walks, pats and scritches. 13/10 much excite https://t.co/ejExJFq3ek",13,10,Venti,3987,25134,Bernese_mountain_dog,
875747767867523072,"This is Goose. He's a womanizer. Cheeky as h*ck, but also deep. Tongue slip game on another level. 13/10 will steal your girl https://t.co/V2WlACRJCN",13,10,Goose,3650,22562,Labrador_retriever,
875144289856114688,Meet Nugget and Hank. Nugget took Hank's bone. Hank is wondering if you would please return it to him. Both 13/10 would not intervene https://t.co/ogith9ejNj,13,10,Nugget,4218,19739,Siberian_husky,
874680097055178752,Meet Cash. He hath acquired a stick. A very good stick tbh. 12/10 would pat head approvingly https://t.co/lZhtizkURD,12,10,Cash,3998,25034,Labrador_retriever,
874296783580663808,This is Jed. He may be the fanciest pupper in the game right now. Knows it too. 13/10 would sign modeling contract https://t.co/0YplNnSMEm,13,10,Jed,3545,23420,cocker_spaniel,pupper
874012996292530176,"This is Sebastian. He can't see all the colors of the rainbow, but he can see that this flag makes his human happy. 13/10 #PrideMonth puppo https://t.co/XBE0evJZ6V",13,10,Sebastian,8735,30669,Cardigan,puppo
873213775632977920,"This is Sierra. She's one precious pupper. Absolute 12/10. Been in and out of ICU her whole life. Help Sierra below

https://t.co/Xp01EU3qyD https://t.co/V5lkvrGLdQ",12,10,Sierra,1351,6434,vizsla,pupper
872620804844003328,This is Monkey. She's supporting owners everywhere with her fancy #PrideMonth bandana. 13/10 love is love is love... https://t.co/lUcpnZDPz9,13,10,Monkey,3118,18690,cocker_spaniel,
871879754684805121,Say hello to Lassie. She's celebrating #PrideMonth by being a splendid mix of astute and adorable. Proudly supupporting her owner. 13/10 https://t.co/uK6PNyeh9w,13,10,Lassie,9420,33735,Shetland_sheepdog,
871762521631449091,This is Rover. As part of pupper protocol he had to at least attempt to eat the plant. Confirmed not tasty. Needs peanut butter. 12/10 https://t.co/AiVljI6QCg,12,10,Rover,3021,18224,Labrador_retriever,pupper
871515927908634625,This is Napolean. He's a Raggedy East Nicaraguan Zoom Zoom. Runs on one leg. Built for deception. No eyes. Good with kids. 12/10 great doggo https://t.co/PR7B7w1rUw,12,10,Napolean,3006,18217,komondor,doggo
871032628920680449,"This is Boomer. He's doing an advanced water takeoff. The opposite of Sully. Ears for control, mlem for style. 13/10 simply breathtaking https://t.co/noNpY2Laoo",13,10,Boomer,3297,20531,kelpie,
870656317836468226,"This is Cody. He zoomed too aggressively and tore his ACL. Happens to the best of us. Still 13/10

Help Cody here: https://t.co/4hxnDOt1CV https://t.co/42ryYRQ2Q4",13,10,Cody,2246,11072,Pembroke,
870374049280663552,This is Zoey. She really likes the planet. Would hate to see willful ignorance and the denial of fairly elemental science destroy it. 13/10 https://t.co/T1xlgaPujm,13,10,Zoey,23207,75312,golden_retriever,
870308999962521604,"This is Rumble, but he's not ready to. Would rather fall asleep in his bath bucket. 13/10 would attempt a boop without waking https://t.co/MVQCzrF1g9",13,10,Rumble,3615,19833,Greater_Swiss_Mountain_dog,
869772420881756160,"This is Dewey (pronounced ""covfefe""). He's having a good walk. Arguably the best walk. 13/10 would snug softly https://t.co/HciEaJkC4D",13,10,Dewey,8850,38633,Pembroke,
869702957897576449,Meet Stanley. He likes road trips. Will shift for you. One ear more effective than other. 13/10 we don't leave until you buckle pup Stanley https://t.co/vmCu3PFCQq,13,10,Stanley,5483,25488,Pembroke,
869596645499047938,This is Scout. He just graduated. Officially a doggo now. Have fun with taxes and losing sight of your ambitions. 12/10 would throw cap for https://t.co/DsA2hwXAJo,12,10,Scout,2686,14460,Chihuahua,doggo
869227993411051520,This is Gizmo. His favorite thing is standing pupright like a hooman. Sneaky tongue slip status achieved. 13/10 would boop well https://t.co/IoR3n1fiiQ,13,10,Gizmo,3261,18466,Pembroke,
868552278524837888,"Say hello to Cooper. His expression is the same wet or dry. Absolute 12/10 but Coop desperately requests your help

https://t.co/ZMTE4Mr69f https://t.co/7RyeXTYLNi",12,10,Cooper,1788,9139,whippet,
867774946302451713,Meet Harold.  He's h*ckin cooperative. 13/10 good work Harold https://t.co/ZYg3NZGICa,13,10,Harold,6374,30778,Border_collie,
867421006826221569,This is Shikha. She just watched you drop a skittle on the ground and still eat it. Could not be less impressed. 12/10 superior puppo https://t.co/XZlZKd73go,12,10,Shikha,2155,14595,Eskimo_dog,puppo
866686824827068416,This is Lili. She can't believe you betrayed her with bath time. Never looking you in the eye again. 12/10 would puppologize profusely https://t.co/9b9J46E86Z,12,10,Lili,3014,17436,flat-coated_retriever,
866450705531457537,"This is Jamesy. He gives a kiss to every other pupper he sees on his walk. 13/10 such passion, much tender https://t.co/wk7TfysWHr",13,10,Jamesy,30886,110864,French_bulldog,pupper
866334964761202691,This is Coco. At first I thought she was a cloud but clouds don't bork with such passion. 12/10 would hug softly https://t.co/W86h5dgR6c,12,10,Coco,12455,47438,Samoyed,
865718153858494464,"Meet Boomer. He's just checking pup on you. Hopes you had a good day. If not, he hopes he made it better. 13/10 extremely good boy https://t.co/pozUoHLkGg",13,10,Boomer,4946,23371,golden_retriever,
865359393868664832,This is Sammy. Her tongue ejects without warning sometimes. It's a serious condition. Needs a hefty dose from a BlepiPen. 13/10 https://t.co/g20EmqK7vc,13,10,Sammy,4375,24034,Chesapeake_Bay_retriever,
865006731092295680,This is Nelly. He really hopes you like his Hawaiian shirt. He already tore the tags off. 13/10 h*ck of a puppurchase https://t.co/LbkG5CiM7o,13,10,Nelly,6787,25502,Pembroke,
864279568663928832,This is Meatball. He doing what's known in the industry as a mid-strut mlem. H*ckin fancy boy. 12/10 I'd do anything for Meatball https://t.co/S2HdmFFPck,12,10,Meatball,2629,13302,bull_mastiff,
864197398364647424,This is Paisley. She ate a flower just to prove she could. Savage af. 13/10 would pet so well https://t.co/cPq9fYvkzr,13,10,Paisley,7742,27173,golden_retriever,
863553081350529029,This is Neptune. He's a backpup vocalist for the Dixie Chicks. 13/10 (vid by @AmiWinehouse) https://t.co/tordvmaaop,13,10,Neptune,3696,13909,Eskimo_dog,
863432100342583297,This is Belle. She's never been more pupset. Encountered the worst imaginable type of zone. 12/10 would do anything to cheer pup https://t.co/fGQUzR8w3H,12,10,Belle,4632,21721,Staffordshire_bullterrier,
863062471531167744,"Say hello to Quinn. She's quite the goofball. Not even a year old. Confirmed 13/10 but she really needs your help 

https://t.co/MOBkQnyHib https://t.co/EsOB4rLEKt",13,10,Quinn,2123,7658,French_bulldog,
862831371563274240,"This is Zooey. She's the world's biggest fan of illiterate delivery people. 13/10 not your fault they don't listen, Zooey https://t.co/ixOFQ1tfqE",13,10,Zooey,4543,17515,Australian_terrier,
862722525377298433,"This is Dave. He passed the h*ck out. It's barely the afternoon on a Thursday, Dave. Get it together. Still 11/10 would boop mid-snooze https://t.co/Eme9Uar6v2",11,10,Dave,3147,15611,basset,
861383897657036800,This is Hobbes. He's never seen bubbles before. 13/10 deep breaths buddy https://t.co/QFRlbZw4Z1,13,10,Hobbes,9460,32900,Cardigan,
861005113778896900,This is Burt. He thinks your thesis statement is comically underdeveloped. 12/10 intellectual af https://t.co/jH6EN9cEn6,12,10,Burt,3390,15290,German_shepherd,
860563773140209665,"Meet Lorenzo. He's an avid nifty hat wearer and absolute 13/10, but he needs your help to beat cancer. Link below

https://t.co/qZdSdzm08p https://t.co/oDIQ1KkdPt",13,10,Lorenzo,1888,6845,Cardigan,
860524505164394496,This is Carl. He likes to dance. Doesn't care what you think about it. 13/10 h*ckin confident pup https://t.co/C2zHcNIu4I,13,10,Carl,4699,21659,Bedlington_terrier,
859924526012018688,Meet Milky. She has no idea what happened. Just as pupset as you. Perhaps a sheep exploded. Even offered to help clean. 12/10 very good girl https://t.co/g8vpXFzw29,12,10,Milky,3653,17976,French_bulldog,
859851578198683649,Meet Trooper. He picks pup recyclables that have blown out of bins in the neighborhood and puts them back. 13/10 environmentally savvy af https://t.co/BqSttrTuIl,13,10,Trooper,3138,14218,Labrador_retriever,
858471635011153920,This is Sophie. She just arrived. Used pawority shipping. Speedy as h*ck delivery. 13/10 would carefully assemble https://t.co/8jOC4zhNxy,13,10,Sophie,4351,19874,Pembroke,
858107933456039936,This is Wyatt. He had an interview earlier today. Was just told he didn't get the job. A h*ckin injustice. Still 12/10 keep your chin pup https://t.co/QXA4sCXSDF,12,10,Wyatt,2580,14512,golden_retriever,
857989990357356544,This is Rosie. She was just informed of the walk that's about to happen. Knows there are many a stick along the way. 12/10 such excite https://t.co/sOl7cFaP5X,12,10,Rosie,2308,14781,French_bulldog,
857746408056729600,Meet Thor. He doesn't have finals because he's a dog but is pupset you have finals. Just wants to play. 13/10 would abandon education for https://t.co/7IFn3rkJai,13,10,Thor,9536,31421,Labrador_retriever,
857263160327368704,This is Oscar and Oliver. Oliver shrunk Oscar. Oscar isn't pleased about it. Quite pupset tbh. Oliver doesn't seem to mind. Both 13/10 https://t.co/e3U4NReleC,13,10,Oscar,4055,18551,Samoyed,
857029823797047296,This is Zeke. He performs group cheeky wink tutorials. Pawfect execution here. 12/10 would wink back https://t.co/uMH5CLjXJu,12,10,Zeke,3561,17378,golden_retriever,
856543823941562368,This is Callie. She'll be your navigator today. Takes her job very seriously. Will shift for you. One ear always in the pupholder. 12/10 https://t.co/Bh9DtLhIBO,12,10,Callie,2596,15129,Boston_bull,
856282028240666624,"This is Cermet, Paesh, and Morple. They are absolute h*ckin superstars. Watered every day so they can grow. 14/10 for all https://t.co/GUefqUmZv8",14,10,Cermet,5684,25712,Chihuahua,
855459453768019968,"Guys, we only rate dogs. This is quite clearly a bulbasaur. Please only send dogs. Thank you... 12/10 human used pet, it's super effective https://t.co/Xc7uj1C64x",12,10,quite,7439,27610,Blenheim_spaniel,
854732716440526848,This is Marlee. She fetched a flower and immediately requested that it be placed behind her ear. 12/10 elegant af https://t.co/nJztIEON5s,12,10,Marlee,5486,21111,Pembroke,
854482394044301312,This is Arya. She can barely contain her excitement for more peanut butter. Also patriotic af. 13/10 https://t.co/AL4Ahm1Rm5,13,10,Arya,6145,27119,Chihuahua,
854365224396361728,This is Einstein. He's having a really good day. Hopes you are too. H*ckin nifty tongue. 13/10 would snug intensely https://t.co/mdaQhhfpv6,13,10,Einstein,4246,17530,Pembroke,
853760880890318849,Say hello to Alice. I'm told she enjoys car rides and smells good. 12/10 would give her everything she could ever want https://t.co/yT4vw8y77x,12,10,Alice,5215,26578,miniature_pinscher,
852912242202992640,"Meet Benny. He likes being adorable and making fun of you while you're on the trampoline. 12/10 let's help him out

https://t.co/aVMjBqAy1x https://t.co/7gx2LksT3U",12,10,Benny,1639,8406,Great_Dane,
852672615818899456,This is Aspen. She's never tasted a stick so succulent. On the verge of tears. A face of pure appreciation. 12/10 https://t.co/VlyBzOXHEW,12,10,Aspen,1973,13926,golden_retriever,
852553447878664193,This is Jarod. He likes having his belly brushed. Tongue ejects when you hit the right spot. 13/10 downright h*ckin adorable https://t.co/ArnxkyD2kC,13,10,Jarod,3177,15184,bloodhound,
850753642995093505,"This is Kyle. He made a joke about your shoes, then stuck his tongue out at you. Uncalled for. Step the h*ck up Kyle. 11/10 would forgive https://t.co/hLQ2Ilg2uN",11,10,Kyle,8274,28724,pug,
850380195714523136,This is Leo. He's a personal triathlon coach. Currently overseeing this athlete's push-pups. H*ckin brutal. 13/10 would do all he asks of me https://t.co/FXZQtBcnTO,13,10,Leo,2388,12302,Yorkshire_terrier,
850019790995546112,Say hello to Boomer. He's a sandy pupper. Having a h*ckin blast. 12/10 would pet passionately https://t.co/ecb3LvExde,12,10,Boomer,4480,19156,Shetland_sheepdog,pupper
849412302885593088,This is Noosh. He noticed you were in the shower and thought you could use some company. 12/10 h*ckin loyal https://t.co/Uq3ChFgWA3,12,10,Noosh,2896,14946,schipperke,
848324959059550208,Meet Odin. He's supposed to be giving directions but he'd rather look at u like that. Should probably buckle pup. 12/10 distracting as h*ck https://t.co/1pSqUbLQ5Z,12,10,Odin,4253,23307,malamute,
848212111729840128,"This is Jerry. He's doing a distinguished tongue slip. Slightly patronizing tbh. You think you're better than us, Jerry? 6/10 hold me back https://t.co/DkOBbwulw1",6,10,Jerry,2776,15339,Bedlington_terrier,
847842811428974592,"This is Rontu. He is described as a pal, cuddle bug, protector and constant shadow. 12/10, but he needs your help

https://t.co/zK4cpKPFfU https://t.co/7Xvoalr798",12,10,Rontu,1215,5114,Bernese_mountain_dog,
847606175596138505,This is Cannon. He just heard something behind him. Fr*ckin frightened af. 12/10 don't look back just run https://t.co/WTPBWT6Ux1,12,10,Cannon,3155,17714,Cardigan,
847251039262605312,This is Furzey. He's doing an elevated sandy zoom. Adjusts ears to steer. 12/10 would pet mid flight https://t.co/zhbRIZQgnq,12,10,Furzey,4002,19372,Airedale,
847157206088847362,"Meet Daisy. She's been pup for adoption for months now but hasn't gotten any applications. 11/10 let's change that

https://t.co/Jlb9L0m3J0 https://t.co/Eh7fGFuy6r",11,10,Daisy,5361,18729,Staffordshire_bullterrier,
846874817362120707,"This is Tuck. As you can see, he's rather h*ckin rare. Taken seriously until his legs are seen. Tail stuck in a permanent zoom. 13/10 https://t.co/P7PBGqrKSe",13,10,Tuck,3626,18984,Shetland_sheepdog,
846514051647705089,This is Barney. He's an elder doggo. Hitches a ride when he gets tired. Waves goodbye before he leaves. 13/10 please come back soon https://t.co/cFAasDXauK,13,10,Barney,10639,41986,golden_retriever,doggo
846153765933735936,This is Vixen. He really likes bananas. Steals them when he thinks nobody's watching. 13/10 opportunistic af https://t.co/a0CkS5ExFR,13,10,Vixen,8368,29719,giant_schnauzer,
846042936437604353,Meet Jarvis. The snow pupsets him. Officially ready for summer. 12/10 would perform a chilly boop https://t.co/0hLkztpiOW,12,10,Jarvis,2644,15106,golden_retriever,
845397057150107648,"Say hello to Mimosa. She's an emotional support doggo who helps her owner with PTSD. 13/10, but she needs your help

https://t.co/L6mLzrd7Mx https://t.co/jMutBFdw5o",13,10,Mimosa,1646,7238,Dandie_Dinmont,doggo
845306882940190720,This is Pickles. She's a silly pupper. Thinks she's a dish. 12/10 would dry https://t.co/7mPCF4ZwEk,12,10,Pickles,4983,22060,Irish_water_spaniel,pupper
844973813909606400,"This is Brady. He's a recovering alcoholic. Demonstrating incredible restraint here. 12/10 don't give pup, don't give in, Brady https://t.co/B1iBuSq3hr",12,10,Brady,2922,14224,Labrador_retriever,
844223788422217728,This is Margo. She just dug pup a massive hole. Can't wait for you to see it. H*ckin proud of herself. 12/10 would forgive then pet https://t.co/H38HB6rBTx,12,10,Margo,2024,12963,Labrador_retriever,
