tweet_id,text,rating_numerator,rating_denominator,name,retweets,favorites,breed,stage
808838249661788160,This is Ito. He'll be your uber driver tonight. Currently adjusting the mirrors. 13/10 incredibly h*ckin responsible https://t.co/Zrrcw29o13,13,10,Ito,2915,9822,Rottweiler,
808501579447930884,This is Koda. He dug a hole and then sat in it because why not. Unamused by the bath that followed. 12/10 https://t.co/SQhyqrr8px,12,10,Koda,2489,10969,Airedale,
808001312164028416,This is Cooper. He likes to stick his tongue out at you and then laugh about it. 12/10 quite the jokester https://t.co/O9iGgvfuzl,12,10,Cooper,3372,12113,Labrador_retriever,
807621403335917568,This is Ollie Vue. He was a 3 legged pupper on a mission to overcome everything. This is very hard to write. 14/10 we will miss you Ollie https://t.co/qTRY2qX9y4,14,10,Ollie,3459,14123,golden_retriever,pupper
807106840509214720,This is Stephan. He just wants to help. 13/10 such a good boy https://t.co/DkBYaCAg2d,13,10,Stephan,52803,113950,Chihuahua,
807010152071229440,This is Lennon. He's a Boopershnoop Pupperdoop. Quite rare. Exceptionally pettable. 12/10 would definitely boop that shnoop https://t.co/fhgP6vSfhX,12,10,Lennon,3709,12727,golden_retriever,
806542213899489280,This is Waffles. He's concerned that the dandruff shampoo he just bought is faulty. 11/10 tragic af https://t.co/BCB87qUU0h,11,10,Waffles,2264,9896,vizsla,
806219024703037440,We only rate dogs. Please stop sending in non-canines like this Freudian Poof Lion. This is incredibly frustrating... 11/10 https://t.co/IZidSrBvhi,11,10,incredibly,1156,6265,chow,
805932879469572096,This is Major. He put on a tie for his first real walk. Only a little crooked. Can also drool upwards. H*ckin talented. 12/10 https://t.co/Zcwr8LgoO8,12,10,Major,1847,8044,Norwegian_elkhound,
805826884734976000,This is Duke. He is not a fan of the pupporazzi. 12/10 https://t.co/SgpBVYIL18,12,10,Duke,1745,6369,Siberian_husky,
805520635690676224,This is Zeke the Wonder Dog. He never let that poor man keep his frisbees. One of the Spartans all time greatest receivers. 13/10 RIP Zeke https://t.co/zacX7S6GyJ,13,10,Zeke,1587,5583,malinois,
805207613751304193,This is Shooter. He's doing quite the snowy zoom. 12/10 https://t.co/lHy4Xbyhd9,12,10,Shooter,1655,7614,Pembroke,
804738756058218496,This is Django. He accidentally opened the front facing camera. Did him quite the frighten. 12/10 https://t.co/kQVQoOW9NZ,12,10,Django,3667,13232,Tibetan_mastiff,
803773340896923648,This is Diogi. He fell in the pool as soon as he was brought home. Clumsy puppo. 12/10 would pet until dry https://t.co/ZxeRjMKaWt,12,10,Diogi,2621,9736,miniature_pinscher,puppo
803276597545603072,This is Winston. His selfie game is legendary. Will steal your girl with a single snap. 11/10 handsome as h*ck https://t.co/jxQhxoPsgL,11,10,Winston,2344,9724,Pembroke,
802952499103731712,This is Marley. She's having a ruff day. Pretty pupset. 12/10 would assist https://t.co/yLm7hQ6UXh,12,10,Marley,1915,8756,chow,
802572683846291456,This is Winnie. She's h*ckin ferocious. Dandelion doesn't even see her coming. 12/10 would pet with caution https://t.co/EFfLCP7oQv,12,10,Winnie,2415,8691,golden_retriever,
802239329049477120,This is Loki. He'll do your taxes for you. Can also make room in your budget for all the things you bought today. 12/10 what a puppo https://t.co/5oWrHCWg87,12,10,Loki,2516,8825,Eskimo_dog,puppo
801958328846974976,This is Ronnie. He hopes you're having a great day. Nifty tongue slip. 12/10 would pat head approvingly https://t.co/4fY2bsAm65,12,10,Ronnie,1628,7512,Staffordshire_bullterrier,
801538201127157760,This is Wallace. He'll be your chau-fur this evening. 12/10 eyes on the road Wallace https://t.co/p1RD39XjUe,12,10,Wallace,1995,7977,Pembroke,
801167903437357056,This is Milo. I would do terrible things for Milo. 13/10 https://t.co/R6wJyC2Tey,13,10,Milo,5630,23632,cocker_spaniel,
801115127852503040,This is Bones. He's being haunted by another doggo of roughly the same size. 12/10 deep breaths pupper everything's fine https://t.co/55Dqe0SJNj,12,10,Bones,2011,7830,dalmatian,"doggo,pupper"
800751577355128832,Say hello to Mauve and Murphy. They're rather h*ckin filthy. Preferred nap over bath. Both 12/10 https://t.co/4UwCTW3lXG,12,10,Mauve,2682,10279,cocker_spaniel,
800513324630806528,This is Chef. Chef loves everyone and wants everyone to love each other. 11/10 https://t.co/ILHGs0e6Dm,11,10,Chef,2876,12754,Pembroke,
800388270626521089,This is Doc. He takes time out of every day to worship our plant overlords. 12/10 quite the floofer https://t.co/azMneS6Ly5,12,10,Doc,2672,10814,golden_retriever,floofer
800141422401830912,This is Peaches. She's the ultimate selfie sidekick. Super sneaky tongue slip appreciated. 13/10 https://t.co/pbKOesr8Tg,13,10,Peaches,2442,14797,golden_retriever,
799757965289017345,This is Sobe. She's a h*ckin happy doggo. Only one leg tho. Must have good balance. 13/10 would smile back https://t.co/OiH8PaOxB1,13,10,Sobe,2051,8131,Border_collie,doggo
799422933579902976,This is Longfellow (prolly sophisticated). He's a North Appalachian Oatzenjammer. Concerned about wrinkled feets. 12/10 would hug softly https://t.co/bpLuQuxzHZ,12,10,Longfellow,1833,7823,miniature_pinscher,
799297110730567681,This is Jeffrey. He's quite the jokester. Takes it too far sometimes. Still 11/10 would pet https://t.co/YDtZcAiMAf,11,10,Jeffrey,2625,9570,malamute,
799063482566066176,This is Mister. He only wears the most fashionable af headwear. 11/10 h*ckin stylish https://t.co/BXJFKOVnJm,11,10,Mister,2386,7834,Norfolk_terrier,
798933969379225600,This is Iroh. He's in a predicament. 12/10 someone help him https://t.co/KJAKO2kXsL,12,10,Iroh,4267,12668,Siberian_husky,
798925684722855936,This is Shadow. He's a firm believer that they're all good dogs. H*ckin passionate about it too. 11/10 I stand with Shadow https://t.co/8yvpacwBcu,11,10,Shadow,1385,7297,West_Highland_white_terrier,
798209839306514432,This is Cooper. His bow tie was too heavy for the front so he moved it to the side. Balanced af now. 13/10 https://t.co/jG1PAFkB81,13,10,Cooper,2464,10107,Pekinese,
797545162159308800,This is Cassie. She steals things. Guilt increases slightly each time. 12/10 would forgive almost immediately https://t.co/Ia19irLwyB,12,10,Cassie,4694,14126,Pembroke,
797236660651966464,This is Pancake. She loves Batman and winks like a h*ckin champ. 12/10 real crowd pleaser https://t.co/6kqsAjJNhi,12,10,Pancake,6288,19302,collie,
796865951799083009,This is Tyr. He's just checking on you. Nifty af tongue slip. 12/10 would absolutely pet https://t.co/Jgnuiyvq06,12,10,Tyr,1865,7460,Cardigan,
796759840936919040,Say hello to Romeo. He was just told that it's too cold for the pool. H*ckin nonsense. 11/10 would help fill up https://t.co/6hx7ur6sNI,11,10,Romeo,2907,11433,American_Staffordshire_terrier,
796387464403357696,This is Snicku. He's having trouble reading because he's a dog. Glasses only helped a little. Nap preferred. 12/10 would snug well https://t.co/cVLUasbKA5,12,10,Snicku,3981,10667,Pekinese,
796149749086875649,This is Ruby. She just turned on the news. Officially terrified. 11/10 deep breaths Ruby https://t.co/y5KarNXWXt,11,10,Ruby,13656,31145,golden_retriever,
796080075804475393,This is Yogi. He's 98% floof. Snuggable af. 12/10 https://t.co/opoXKxmfFm,12,10,Yogi,2211,8184,chow,
796031486298386433,This is Daisy. She's here to make your day better. 13/10 mission h*ckin successful https://t.co/PbgvuD0qIL,13,10,Daisy,3579,10478,golden_retriever,
795400264262053889,This is Brody. He's trying to make the same face as the football. 12/10 https://t.co/2H4MfOGlpQ,12,10,Brody,2742,9708,golden_retriever,
794332329137291264,This is Nimbus (like the cloud). He just bought this fancy af duck raincoat. Only protects one ear tho. 12/10 so h*ckin floofy https://t.co/SIQbb8c3AU,12,10,Nimbus,2586,9323,Samoyed,
793962221541933056,This is Maximus. His face is stuck like that. Tragic really. Great tongue tho. 12/10 would pet firmly https://t.co/xIfrsMNLBR,12,10,Maximus,4678,16258,Labrador_retriever,
793845145112371200,This is Clark. He was just caught wearing pants. 13/10 game-changing af https://t.co/2Xo19aPrG5,13,10,Clark,1783,8943,Old_English_sheepdog,
793601777308463104,This is Dobby. I can't stop looking at her feet. 12/10 would absolutely snug https://t.co/LhzPWv6rTv,12,10,Dobby,1548,7735,miniature_pinscher,
793500921481273345,This is Fiona. She's an extremely mediocre copilot. Very distracting. Wink makes up for all the missed turns. 12/10 https://t.co/aF5MmpvPqN,12,10,Fiona,2279,10332,golden_retriever,
793286476301799424,This is Moreton. He's the Good Boy Who Lived. 13/10 magical as h*ck https://t.co/rLHGx3VAF3,13,10,Moreton,8772,23796,Afghan_hound,
793271401113350145,Meet Dave. It's his favorite day of the year. He gets to fulfill his dream of being a dinosaur. 12/10 inspirational af https://t.co/MgQSdfZGPN,12,10,Dave,2303,8428,Siberian_husky,
793241302385262592,This is Tucker. He's out here bustin h*ckin ghosts. 13/10 dedicated af https://t.co/Ap477GhwXt,13,10,Tucker,3155,10175,golden_retriever,
793226087023144960,"This is Juno. She spooked me up real good, but only to get my attention. Above average handwriting for a dog I think. 11/10 https://t.co/hFxxBCWlwj",11,10,Juno,2768,9482,wire-haired_fox_terrier,
793195938047070209,Say hello to Lily. She's pupset that her costume doesn't fit as well as last year. 12/10 poor puppo https://t.co/YSi6K1firY,12,10,Lily,5382,14733,Labrador_retriever,puppo
793180763617361921,This is Newt. He's a strawberry. 11/10 https://t.co/2VhmlwxA1Q,11,10,Newt,1917,6706,Lakeland_terrier,
793165685325201412,This is Benji. He's Air Bud. It's a low effort costume but he pulls it off rather h*ckin well. 12/10 would happily get dunked on https://t.co/IbzT7DJvBo,12,10,Benji,2671,9077,golden_retriever,
793150605191548928,This is Nida. She's a free elf. Waited so long for this day. 11/10 https://t.co/3lE8Izgmkf,11,10,Nida,1625,5964,Italian_greyhound,
793120401413079041,"This is Robin. She's desperately trying to do me a frighten, but her tongue drastically decreases her spook value. Still 11/10 great effort https://t.co/sxMrsOZ8zb",11,10,Robin,3753,12244,Labrador_retriever,
792773781206999040,This is Monster. Not an actual monster tho. He's showing you his tongue. Very impressive Monster. 12/10 would snug https://t.co/RhaPExuxJL,12,10,Monster,1617,7142,Yorkshire_terrier,
792394556390137856,Meet BeBe. She rocks the messy bun of your dreams. H*ckin flawless. 12/10 would watch her tutorial https://t.co/of0pFNBIl8,12,10,BeBe,4103,12986,cocker_spaniel,
792050063153438720,This is Remus. He's a mop that came to life. Can't see anything. Constantly trips over himself. Still a very good dog. 11/10 https://t.co/S3f1SYylzu,11,10,Remus,1704,6901,komondor,
791406955684368384,Say hello to Levi. He's a Madagascan Butterbop. One of the more docile Butterbops I've seen. 12/10 would give all the pets https://t.co/Zcw9Sccctc,12,10,Levi,3940,12736,Pembroke,
791312159183634433,This is Mabel. She's super h*ckin smol. Portable af. Comes with the smol shoe. 12/10 would keep in frocket https://t.co/GGJvxYt3xK,12,10,Mabel,2425,8483,miniature_pinscher,
790987426131050500,This is Misty. She has a cowboy hat on her nose. 12/10 https://t.co/Eno0mypHIr,12,10,Misty,2040,9494,cocker_spaniel,
790698755171364864,This is Mosby. He appears to be rather h*ckin snuggable af. 12/10 keep it up Mosby https://t.co/IiiBq460I7,12,10,Mosby,1842,7964,Bernese_mountain_dog,
790337589677002753,Meet Maggie. She can hear your cells divide. 12/10 can also probably fly https://t.co/ovE2hqXryV,12,10,Maggie,1810,7592,Pembroke,
790277117346975746,This is Bruce. He never backs down from a challenge. 11/10 you got this Bruce https://t.co/aI7umZHIq7,11,10,Bruce,3029,12163,Labrador_retriever,
789628658055020548,This is Eli. He can fly. 13/10 magical af https://t.co/huPSJJ7FDI,13,10,Eli,1684,7234,chow,
789599242079838210,This is Brownie. She's wearing a Halloween themed onesie. 12/10 festive af https://t.co/0R4meWXFOx,12,10,Brownie,1839,6509,Chesapeake_Bay_retriever,
789530877013393408,This is Rizzy. She smiles a lot. 12/10 contagious af https://t.co/TU4sZogVIq,12,10,Rizzy,3222,11336,schipperke,
789268448748703744,This is Stella. She's happier than I will ever be. 10/10 would trade lives with https://t.co/JSs2bfDtTS,10,10,Stella,2500,8835,malamute,
789137962068021249,This is Bo. He's a West Congolese Bugaboop Snuggle. Rather exotic. Master of the head tilt. 12/10 would pay to pet https://t.co/2jwxxtNzoN,12,10,Bo,2666,9410,Chihuahua,
788765914992902144,This is Butter. She can have whatever she wants forever. 12/10 would hug softly https://t.co/x5gXRS1abq,12,10,Butter,9853,26437,cocker_spaniel,
788412144018661376,This is Dexter. He breaks hearts for a living. 11/10 h*ckin handsome af https://t.co/4DhSsC1W7S,11,10,Dexter,5036,15016,golden_retriever,
788150585577050112,This is Leo. He's a golden chow. Rather h*ckin rare. 13/10 would give extra pats https://t.co/xosHjFzVXc,13,10,Leo,1222,5915,chow,
787810552592695296,This is Frank. He wears sunglasses and walks himself. 11/10 I'll never be this cool or independent https://t.co/pNNjBtHWPc,11,10,Frank,2903,8311,pug,
787717603741622272,This is Tonks. She is a service puppo. Can hear a caterpillar hiccup from 7 miles away. 13/10 would follow anywhere https://t.co/i622ZbWkUp,13,10,Tonks,2646,9904,German_shepherd,puppo
787397959788929025,This is Moose. He's rather h*ckin dangerous (you can tell by the collar). 11/10 would still attempt to snug https://t.co/lHVHGdDzb3,11,10,Moose,2729,10535,Chihuahua,
786963064373534720,This is Rory. He's got an interview in a few minutes. Looking spiffy af. Nervous as h*ck tho. 12/10 would hire https://t.co/ibj5g6xaAj,12,10,Rory,7614,25761,golden_retriever,
786709082849828864,"This is Logan, the Chow who lived. He solemnly swears he's up to lots of good. H*ckin magical af 9.75/10 https://t.co/yBO5wuqaPS",9.75,10,Logan,5856,17674,Pomeranian,
786595970293370880,This is Dale. He's a real spookster. Did me quite the frighten. 11/10 not too spooky to pet tho https://t.co/L8BWDD4oBX,11,10,Dale,3000,9172,Pembroke,
786363235746385920,This is Rizzo. He has many talents. A true renaissance doggo. 13/10 entertaining af https://t.co/TVXpEJB7Wn,13,10,Rizzo,3303,10491,golden_retriever,doggo
786233965241827333,This is Mattie. She's extremely dangerous. Will bite your h*ckin finger right off. Still 11/10 would pet with caution https://t.co/78c9W8kLFh,11,10,Mattie,4487,14701,Labrador_retriever,
785872687017132033,Meet Rusty. He appears to be rather h*ckin fluffy. Also downright adorable af. 12/10 would rub my face against his https://t.co/1j9kLGb4wV,12,10,Rusty,1706,6468,Great_Pyrenees,
785533386513321988,This is Dallas. Her tongue is ridiculous. 11/10 h*ckin proud af https://t.co/h4jhlH4EyG,11,10,Dallas,1882,8767,miniature_pinscher,
784826020293709826,This is Rusty. He's going D1 for sure. Insane vertical. 13/10 would draft https://t.co/AsykOwMrXQ,13,10,Rusty,3080,9752,chow,
784517518371221505,This is Frankie. He has yet to learn how to control his tongue. 11/10 maybe one day https://t.co/p6fgYe2dB6,11,10,Frankie,2405,8659,malamute,
784431430411685888,This is Stormy. He's curly af. Already pupared for Coachella next year. 12/10 https://t.co/PHA1vtqqpt,12,10,Stormy,1215,5539,miniature_poodle,
783821107061198850,This is Mairi. She has mastered the art of camouflage. 12/10 h*ckin sneaky af https://t.co/STcPjiNAHp,12,10,Mairi,1867,7114,Lakeland_terrier,
783695101801398276,This is Loomis. He's the leader of the Kenneth search party. The passion is almost overwhelming. 12/10 one day he will be free https://t.co/kCRKlFg4AY,12,10,Loomis,3061,10076,chow,
783466772167098368,This is Finn. He likes eavesdropping from filing cabinets. It's a real issue but no one has approached him about it. 11/10 would still pet https://t.co/s8W8Del9HQ,11,10,Finn,2130,8138,Chihuahua,
783391753726550016,Meet Godi. He's an avid beachgoer and part time rainbow summoner. Eyeliner flawless af. 13/10 would snug well https://t.co/BO936YdJdi,13,10,Godi,5198,16299,Norwegian_elkhound,
783334639985389568,This is Dave. He's currently in a predicament. Doesn't seem to mind tho. 12/10 someone assist Dave https://t.co/nfprKAXqwu,12,10,Dave,11114,28040,Cardigan,
783085703974514689,This is Earl. He can't catch. Did his best tho. 11/10 would repair confidence with extra pats https://t.co/IsqyvbjFgM,11,10,Earl,2072,7870,Chesapeake_Bay_retriever,
782747134529531904,This is Deacon. He's the happiest almost dry doggo I've ever seen. 11/10 would smile back https://t.co/C6fUMnHt1H,11,10,Deacon,1345,7217,golden_retriever,doggo
782722598790725632,"This is Penny. She fought a bee and the bee won. 10/10 you're fine Penny, everything's fine https://t.co/zrMVdfFej6",10,10,Penny,5122,16632,Irish_setter,
782598640137187329,This is Timmy. He's quite large. According to a trusted source it's actually a dog wearing a dog suit. 11/10 https://t.co/BIUchFwHqn,11,10,Timmy,1794,7533,malamute,
782305867769217024,This is Sampson. He just graduated. Ready to be a doggo now. Time for the real world. 12/10 have fun with taxes https://t.co/pgVKxRw0s1,12,10,Sampson,5254,16011,briard,doggo
781251288990355457,This is Oakley. He just got yelled at for going 46 in a 45. Churlish af. 11/10 would still pet so well https://t.co/xIYsa6LPA4,11,10,Oakley,1975,8090,Mexican_hairless,
780858289093574656,"This is Dash. He's very stylish, but also incredibly unimpressed with the current state of our nation. 10/10 would pet ears first https://t.co/YElO4hvXI6",10,10,Dash,1911,6932,Chesapeake_Bay_retriever,
780800785462489090,This is Koda. He has a weird relationship with tall grass. Slightly concerning. 11/10 would def still pet https://t.co/KQzSR8eCsw,11,10,Koda,1228,5283,Siberian_husky,
780601303617732608,Meet Hercules. He can have whatever he wants for the rest of eternity. 12/10 would snug passionately https://t.co/mH0IOyFdIG,12,10,Hercules,3184,11654,Saint_Bernard,
780459368902959104,"This is Bear. Don't worry, he's not a real bear tho. Contains unreal amounts of squish. 11/10 heteroskedastic af https://t.co/coi4l1T2Sm",11,10,Bear,1020,5093,Great_Dane,
779834332596887552,This is Scout. He really wants to kiss himself. H*ckin inappropriate. 11/10 narcissistic af https://t.co/x0gV2Ck3AD,11,10,Scout,6643,18101,golden_retriever,
778990705243029504,This is Jay. He's really h*ckin happy about the start of fall. Sneaky tongue slip in 2nd pic. 11/10 snuggly af https://t.co/vyx1X5eyWI,11,10,Jay,6788,19145,cocker_spaniel,
778748913645780993,"This is Mya (pronounced ""mmmyah?""). Her head is round af. 11/10 would pat accordingly https://t.co/1dpEuALnY0",11,10,Mya,1235,6610,Staffordshire_bullterrier,
778650543019483137,"Meet Strider. He thinks he's a sorority girl. Already wants to go to NYC for a weekend to say he's ""studied abroad"" 10/10 https://t.co/KYZkPuiC1l",10,10,Strider,1416,5526,German_shepherd,
778624900596654080,This is Penny. She's a sailor pup. 11/10 would take to the open seas with https://t.co/0rRxyBQt32,11,10,Penny,959,4427,Airedale,
778383385161035776,This is Nala. She's a future Dogue model. Won't respond to my texts. 13/10 would be an honor to pet https://t.co/zP1IvAATWv,13,10,Nala,1040,5607,collie,
778286810187399168,This is Stanley. He has too much skin. Isn't happy about it. Quite pupset actually. Still 11/10 would comfort https://t.co/hhTfnPrWfb,11,10,Stanley,3133,9952,Boston_bull,
778027034220126208,This is Sophie. She's a Jubilant Bush Pupper. Super h*ckin rare. Appears at random just to smile at the locals. 11.27/10 would smile back https://t.co/QFaUiIHxHq,11.27,10,Sophie,1521,6320,clumber,pupper
777885040357281792,This is Wesley. He's clearly trespassing. Seems rather h*ckin violent too. Weaponized forehead. 3/10 wouldn't let in https://t.co/pL7wbMRW7M,3,10,Wesley,1547,6118,Afghan_hound,
777621514455814149,This is Derek. You can't look at him and not smile. Must've just had a blue pupsicle. 12/10 would snug intensely https://t.co/BnVTMtUeI3,12,10,Derek,2382,8406,chow,
777189768882946048,This is Jeffrey. He's being held so he doesn't fly away. 12/10 would set free https://t.co/d3aLyCykn7,12,10,Jeffrey,4073,13615,Chihuahua,
776813020089548800,Meet Solomon. He was arrested for possession of adorable and attempted extra pats on the head. 12/10 would post bail https://t.co/nFqLaOLUQA,12,10,Solomon,1141,4691,toy_poodle,
776477788987613185,This is Huck. He's addicted to caffeine. Hope it's not too latte to seek help. 11/10 stay strong pupper https://t.co/iJE3F0VozW,11,10,Huck,2621,8433,Labrador_retriever,pupper
776201521193218049,This is O'Malley. That is how he sleeps. Doesn't care what you think about it. 10/10 comfy af https://t.co/Pq150LeRaC,10,10,O,2385,9195,Rottweiler,
775842724423557120,This is Blue. He was having an average day until his owner told him about Bront. 12/10 h*ckin hysterical af https://t.co/saRYTcxQeH,12,10,Blue,2510,11243,chow,
775364825476165632,This is Finley. He's an independent doggo still adjusting to life on his own. 11/10 https://t.co/7FNcBaKbci,11,10,Finley,2793,7083,beagle,doggo
775085132600442880,This is Tucker. He would like a hug. 13/10 someone hug him https://t.co/wdgY9oHPrT,13,10,Tucker,4466,14919,chow,
774757898236878852,This is Finley. She's a Beneboop Cumbersplash. 12/10 I'd do unspeakable things for Finley https://t.co/dS8SCbNF9P,12,10,Finley,1688,8288,toy_poodle,
774639387460112384,This is Sprinkles. He's trapped in light jail. 10/10 would post bail for him https://t.co/4s5Xlijogu,10,10,Sprinkles,1643,6473,Walker_hound,
773922284943896577,"This is Heinrich (pronounced ""Pat""). He's a Botswanian Vanderfloof. Snazzy af bandana. 12/10 downright puptacular https://t.co/G56ikYAqFg",12,10,Heinrich,1653,6160,Pomeranian,
773704687002451968,This is Loki. He knows he's adorable. One ear always pupared. 12/10 would snug in depicted fashion forever https://t.co/OqNggd4Oio,12,10,Loki,1529,6355,silky_terrier,
773670353721753600,This is Shakespeare. He appears to be maximum level pettable. Born with no eyes tho (tragic). 10/10 probably wise https://t.co/rA8WUVOLBr,10,10,Shakespeare,1249,5153,Old_English_sheepdog,
773547596996571136,This is Chelsea. She forgot how to dog. 11/10 get it together pupper https://t.co/nBJ5RE4yHb,11,10,Chelsea,5798,21200,Norwegian_elkhound,pupper
773191612633579521,This is Grey. He's the dogtor in charge of your checkpup today. 12/10 I'd never miss an appointment https://t.co/9HEVPJEioD,12,10,Grey,3901,9591,Blenheim_spaniel,
772826264096874500,"Meet Roosevelt. He's preparing for takeoff. Make sure tray tables are in their full pupright &amp; licked position
11/10 https://t.co/7CQkn3gHOQ",11,10,Roosevelt,2246,7717,basset,
772193107915964416,This is Willem. He's a Penn State pupper. Thinks the hood makes him more intimidating. It doesn't. 12/10 https://t.co/Dp0s7MRIHK,12,10,Willem,1311,5767,Pembroke,pupper
772117678702071809,Meet Jack. He's a Clemson pup. Appears to be rather h*ckin pettable. Almost makes me want to root for Clemson. 12/10 https://t.co/GHOfbTVQti,12,10,Jack,697,3608,Labrador_retriever,
772114945936949249,This is Finn. He's very nervous for the game. Has a lot of money riding on it.10/10 would attempt to comfort https://t.co/CbtNfecWiT,10,10,Finn,448,2622,Chihuahua,
772102971039580160,This is Penny. She's an OU cheerleader. About to do a triple back handspring down the stairs. 11/10 hype af https://t.co/B2f3XkGU5c,11,10,Penny,886,3829,Pembroke,
771770456517009408,This is Davey. He'll have your daughter home by 8. Just a stand up pup. 11/10 would introduce to mom https://t.co/E6bGWf9EOm,11,10,Davey,3203,11505,papillon,
771500966810099713,This is Dakota. He's just saying hi. That's all. 12/10 someone wave back https://t.co/1tWe5zZoHv,12,10,Dakota,2469,7931,Labrador_retriever,
771380798096281600,Meet Fizz. She thinks love is a social construct consisting solely of ideals perpetuated by mass media 11/10 woke af https://t.co/sPB5JMnWBn,11,10,Fizz,4785,10087,collie,
771102124360998913,This is Charlie. He works for @TODAYshow. Super sneaky tongue slip here. 12/10 would pet until someone made me stop https://t.co/K5Jo7QRCvA,12,10,Charlie,1361,5967,Labrador_retriever,
770787852854652928,This is Winston. His tongue has gone rogue. Doing him quite a frighten. 10/10 hang in there Winston https://t.co/d0QEbp78Yi,10,10,Winston,1136,4727,Bernese_mountain_dog,
770772759874076672,This is Sebastian. He's super h*ckin fluffy. That's really all you need to know. 11/10 would snug intensely https://t.co/lqr0NdtwQo,11,10,Sebastian,1346,4968,chow,
770293558247038976,This is Jackson. There's nothing abnormal about him. Just your average really good dog. 10/10 https://t.co/3fEPpj0KYw,10,10,Jackson,1382,5943,Italian_greyhound,
770069151037685760,Say hello to Carbon. This is his first time swimming. He's having a h*ckin blast. 10/10 we should all be this happy https://t.co/mADHGenzFS,10,10,Carbon,2161,7274,Boston_bull,
769940425801170949,This is Klein. These pics were taken a month apart. He knows he's a stud now. 12/10 total heartthrob https://t.co/guDkLrX8zV,12,10,Klein,9014,29907,miniature_pinscher,
769695466921623552,This is Titan. He's trying to make friends. Offering up his favorite stick. 13/10 philanthropic af https://t.co/vhrkz0dK4v,13,10,Titan,1595,6162,pug,
769212283578875904,This is DonDon. He's way up but doesn't feel blessed. Rather uncomfortable actually. 12/10 I'll save you DonDon https://t.co/OCYLz3fjVE,12,10,DonDon,1629,5165,golden_retriever,
768970937022709760,This is Kirby. His bowl weighs more than him. 12/10 would assist https://t.co/UlB2mzw3Xs,12,10,Kirby,6127,13662,Pomeranian,
768855141948723200,This is Jesse. He really wants a belly rub. Will be as cute as possible to achieve that goal. 11/10 https://t.co/1BxxcdVNJ8,11,10,Jesse,844,4012,chow,
